0,1,2,3,4,5,6,7,8
2021-04-08 16:04:11,Topomares,183375057,Sevilla  España (SPAIN),1380189741975494657,1,0,[],"La vacuna rusa Sputnik, dicen que es muy buena, pero nada comparado,   con  los cubatas que prepara Putin para sus… https://t.co/uE8FzIYZfB"
2021-04-08 16:04:02,ElDigitalAB,1219839072,"Albacete, España",1380189703274647553,2,1,[],Docentes piden una reunión con el Gobierno por la suspensión de la vacunación con AstraZeneca - https://t.co/qZ4fOC8aFo
2021-04-08 16:03:32,JosAlfo12870753,1084173794586042368,"Madrid, Comunidad de Madrid",1380189575511994372,0,0,[],@Vive_Carpe @jezquerra57 @_YolandaFuentes Ninguna demagogia. El ibuprofeno es un fármaco muchísimo más peligroso qu… https://t.co/nNKiyvF21Z
2021-04-08 16:02:36,Topomares,183375057,Sevilla  España (SPAIN),1380189340366733316,0,0,[],"@wu_ming_80 @encasadeherrero La vacuna rusa Sputnik, dicen que es muy buena, pero nada comparado,   con  los cubata… https://t.co/cAOricmLC1"
2021-04-08 16:02:34,DavidGarridoBaz,120949785,"Merida, Spain",1380189334775734283,1,0,[],Creo que pocas veces se ha visto con tanta claridad los peligros de la sobreinformación mal digerida en las redes y… https://t.co/9Y6flzYhjB
2021-04-08 16:02:33,mikelcallejo,102100426,"Leganés, España",1380189330715578370,1,0,[],"Esta es la clave: la vacunación es una cuestión de grupo. Si esta mujer, tras perder a su hermano, es capaz de ente… https://t.co/C1RzO1BUIQ"
2021-04-08 16:02:28,JosMHernndezV,484693767,Segovia,1380189308129316868,1,0,[],@Zurine3 De sentido comun. Suspender la administracion de esta vacuna a las mujeres de edad inferior a 60 años y se… https://t.co/pIMqjjdgKN
2021-04-08 16:02:11,jaiime2410,2577441040,,1380189238310887427,0,0,[],"@Basiluisco Todos estos argumentos de coger la estadistica y lanzarla como una piedra son muy cutres
Siguiendo con… https://t.co/RQ6ZFlUFbM"
2021-04-08 16:02:07,triplersa,376096130,"Santander, España",1380189218455044102,0,0,[],"Yo prefiero morir, morir, a quedarme hemipléjica y afásica o sin medio cerebro en unas horas. Tengo antecedentes fa… https://t.co/DUvJnHw1Yt"
2021-04-08 16:01:53,esemanu,59276633,"Alcorcón, España",1380189162993778694,0,0,[],@kinete21 Sputnik. Parece que la propia Astra sopesó  completar la vacuna con una segunda dosis de la vacuna rusa (… https://t.co/kY3quF55Py
2021-04-08 16:01:28,JosAlfo12870753,1084173794586042368,"Madrid, Comunidad de Madrid",1380189056227762186,0,0,[],"@Vive_Carpe @jezquerra57 @_YolandaFuentes Eso sería en condiciones normales, no en una emergencia sanitaria donde c… https://t.co/0IVW9zUX0Z"
2021-04-08 16:01:26,RevistaAlimenta,361814138,Madrid (Spain),1380189046979313675,6,0,"[{'text': 'Distribución', 'indices': [0, 13]}]","#Distribución | Propuesta de la cadena de valor del gran consumo como esencial para la vacunación

Recuerdan su ofr… https://t.co/IK1Hhwcgu2"
2021-04-08 16:01:13,FEVESAlamanca,551901511,Salamanca,1380188994156294145,0,3,"[{'text': 'SALAMANCA', 'indices': [42, 52]}]","💉SÁBADO 10 DE ABRIL: VACUNACIÓN MASIVA EN #SALAMANCA 
Personas nacidas en 1956 y primer semestre de 1957 (que no ha… https://t.co/BVnf1HBRoj"
2021-04-08 16:01:09,pserrano04,290401269,"Madrid, Comunidad de Madrid",1380188976787689475,0,0,[],"@ccarballo50 Sr Carballo, no, no se puede confiar.
Y yo le pregunto, y sede uno poner la vacuna que está gente está… https://t.co/zctgYLCGDh"
2021-04-08 16:01:00,ADECCE_,845078557592301568,"Madrid, Comunidad de Madrid",1380188938791317506,0,0,"[{'text': 'NOTICIA', 'indices': [0, 8]}]",#NOTICIA  Las autoridades sanitarias de Corea del Sur han dicho que reanudarán la administración de las vacunas de… https://t.co/YcQYny0mQs
2021-04-08 16:01:00,NotGip,226611875,Gipuzkoa,1380188938774540288,0,0,"[{'text': 'AstraZeneca', 'indices': [3, 15]}]","💉 [#AstraZeneca] La EMA ha confirmado la relación de esta vacuna con los casos de trombosis registrados, pero recom… https://t.co/S9Apey3z5C"
2021-04-08 16:00:55,palmins_,476173602,"Madrid, Comunidad de Madrid",1380188918809817088,1,0,[],Como me hayan quitado la astrazeneca para ponerme la vacuna rusa xd
2021-04-08 16:00:49,SocialCiudadano,4827746921,"Bizkaia, País Vasco",1380188892289187849,0,2,[],"Casado acusa al Gobierno de ""utilizar la vacunación con intereses partidistas"" y, a la vez, de ""no pintar nada en l… https://t.co/7Uiu4saLKW"
2021-04-08 16:00:44,doctorchuslolo,267879697,,1380188871875526661,9,1,[],Con las dudas de que ponemos a cada quien ya habrán generado X casos nuevos que al no estar vacunados serán algunos… https://t.co/y2NAYjhUe9
2021-04-08 16:00:39,elindepcom,743456072673992704,"Madrid, Comunidad de Madrid",1380188850035822592,25,23,[],"Madrid sigue batiendo su récord de vacunación con 48.192 en 24 horas
https://t.co/qTct2KGXPT"
2021-04-08 16:00:21,MasAlcorcon__,1086588073641676800,"Alcorcón, España",1380188776274726919,3,1,[],Nos alegramos de que se amplíen los puntos de vacunación. Los madrileños y madrileñas deberían poder vacunarse en s… https://t.co/abtxGiKBPE
2021-04-08 16:00:03,la8soria,2542628150,Soria,1380188701930749954,1,0,"[{'text': 'AstraZeneca', 'indices': [87, 99]}]","📺TITULARES📺
🦠Cribado para parar la transmisión comunitaria en Ólvega
💉La vacunación de #AstraZeneca regresará el vi… https://t.co/i5IBplUD41"
2021-04-08 16:00:03,ideal_granada,102687520,Granada,1380188698948476929,0,1,"[{'text': 'Coronavirus', 'indices': [2, 14]}]",⚠ #Coronavirus Un equipo de investigación ha comparado por primera vez las imágenes de los picos que produce la vac… https://t.co/pf7ePYcvos
2021-04-08 16:00:02,granadahoy,10653662,Granada,1380188695995760642,0,0,[],Este es el perfil de las personas que han sufrido trombos con la vacuna de AstraZeneca https://t.co/WNHhKMPkxn
2021-04-08 16:00:02,Gipuzkoa,434979087,Gipuzkoa,1380188695370723328,1,0,"[{'text': 'RealeArena', 'indices': [98, 109]}]",💉 Mañana retomamos la campaña de vacunación con las dosis de Pfizer en el punto de vacunación del #RealeArena. Las… https://t.co/VDL1DbfW17
2021-04-08 16:00:00,tribunapalencia,1372374656,"Palencia, España",1380188689788194816,17,6,[],"💉 La consejera Casado: ""Pondré mi brazo y me vacunaré con AstraZeneca, de la cual me fío mucho""… https://t.co/EOEM5nOgeJ"
2021-04-08 16:00:00,ideal_jaen,193626721,Jaén,1380188688508989447,0,0,"[{'text': 'Coronavirus', 'indices': [2, 14]}]",⚠ #Coronavirus Un equipo de investigación ha comparado por primera vez las imágenes de los picos que produce la vac… https://t.co/vPsC0yncc7
2021-04-08 16:00:00,TribunaSal,305172448,Salamanca,1380188686684332039,0,0,"[{'text': 'Salamanca', 'indices': [44, 54]}]","🛑 ATENCIÓN 🛑
Vacunación masiva el sábado en #Salamanca para nacidos en el 1956 y en el primer semestre de 1957. ZBS… https://t.co/8g1XqQ0xJk"
2021-04-08 16:00:00,comarcaltv,250706788,"Lorca, España",1380188686642515975,3,2,[],El Concejal de Sanidad del Ayuntamiento de Lorca espera que no se vuelvan a producir errores en las citas de la vac… https://t.co/iIe0kAjMmT
2021-04-08 15:59:23,doctorchuslolo,267879697,,1380188530899574784,0,0,[],@Viki_Ortiz @rrarroca por eso la libertad de vacunación pero con información .
2021-04-08 15:59:10,SEGREcom,211265924,Lleida,1380188476793045001,0,0,[],"Expertos piden tranquilidad sobre la vacuna de AstraZeneca: ""los casos son muy infrecuentes"" https://t.co/ozk5RMVxFB"
2021-04-08 15:58:18,KmaradaKsanova,1174747547149242370,València,1380188261105209344,9,3,[],"@ccarballo50 @alfredocorell 5.- Ahora ya no me creo que esto que tengo sea casual, creo que es causal. Mi caso, y e… https://t.co/mIW0tYqBX9"
2021-04-08 15:57:27,anagago2001,68035965,Albacete,1380188045031391237,0,0,[],Pero la vacuna es mala... 🤦🏼‍♀️ https://t.co/lbplDtlkZs
2021-04-08 15:56:57,IU_Madrid,715982930561122305,"Madrid, Comunidad de Madrid",1380187922352246795,23,21,[],"Esta misma mañana tras el acto del Plan de vacunación, nos hemos reunido con @NursingNowMadri para escuchar de prim… https://t.co/Yyaj7KmaRs"
2021-04-08 15:56:33,VozLibre_com,39731574,Madrid,1380187820569071625,2,4,[],"Eduardo Raboso, portavoz de Sanidad del PP, y la diputada Ana Dávila (@adavimu) han visitado el centro de vacunació… https://t.co/YN3mG7wwuz"
2021-04-08 15:56:16,DrRodrigoLastra,2900840269,"Zaragoza, España",1380187747944648708,5,5,"[{'text': 'Cambridge', 'indices': [52, 62]}, {'text': 'Oxford', 'indices': [107, 114]}]","Sopesando riesgo-beneficio.
Desde la Universidad de #Cambridge intentan aportar mas luz sobre la vacuna de #Oxford-… https://t.co/26yuZm1IWN"
2021-04-08 15:56:14,marisabarcelo,571557175,Madrid,1380187739128225798,1,1,[],La Asociación Madrileña de Enfermería y la Plataforma de Centros de Salud de Madrid han presentado en Getafe una pr… https://t.co/jDyEK5YAaX
2021-04-08 15:54:45,HuellasAlmansa,1242142776000684037,"Almansa, España",1380187364824379396,1,2,[],"virus y las secuelas que han dejado en ti😤

Atenas ya esta vacuna y ha sido esterilizada. Además, ha recibido acupu… https://t.co/M1cQe4jdew"
2021-04-08 15:54:41,wrojewski,112677908,Reus,1380187350744104963,1,0,[],@aquilinojperez @dramarialozano De acuerdo. Es una decisión que parece absurda y que no favorece ni transmite para… https://t.co/2KWLYmrkUj
2021-04-08 15:54:32,carmelojorda,28522618,Madrid,1380187311825113088,588,237,[],"Ximo Puig dice que es ""irresponsable"" reunirte con una farmacéutica antes de que su vacuna sea aprobada por la EMA.… https://t.co/hDu9OAuU4U"
2021-04-08 15:54:16,farmaceuticoscc,1354483688046792707,Cáceres,1380187245244780545,8,4,[],"Entrevista a nuestra colegiada Laura Sanchez Amador publicada en la revista @Farmaceuticos_ de este mes. 
“La vacun… https://t.co/kjLQl3yrxR"
2021-04-08 15:54:02,madridactual,50969179,"Comunidad de Madrid, España",1380187184528027651,1,1,"[{'text': 'SanidadMadrid', 'indices': [73, 87]}]",­­📰 Te llamarán desde este número para vacunarte en Madrid: 91 502 60 58 #SanidadMadrid https://t.co/c8L1YyAQFs https://t.co/59HjMZwAS6
2021-04-08 15:53:50,kikegavira,193262204,sevilla,1380187134947160065,0,0,[],"@Alvaradoblog @sanidadgob 🔴Última hora!
Astra/zeneca llega a un acuerdo con Quesos García Baquero,
Para fabricar la… https://t.co/wiuSmg8meV"
2021-04-08 15:53:49,disturbia04,265489641,We ain't ever getting older ,1380187131625275394,5,0,[],Esta tarde le ponen la vacuna a mi padre y tengo miedo 🥺
2021-04-08 15:53:37,avialonte,1286388434,"Valladolid, España",1380187083482992640,0,0,[],"Muere joven de 23 años. D.E.P.
https://t.co/mmacHFPbAi"
2021-04-08 15:53:32,ElDiaDeSoria,4823789002,"Soria, España",1380187060640772098,0,0,[],Soria retoma mañana la vacunación con AstraZeneca https://t.co/lzPWFD97ZS
2021-04-08 15:53:31,EuropaOlimpia,1375809810,Madrid,1380187055519588352,0,0,[],"@FLMIRONES @mariajesus4444 No. De los políticos no me fío ya antes de las vacunas.
Pero hay una presión mediática m… https://t.co/M5zNG5KGU2"
2021-04-08 15:53:28,AntonioRNaranjo,80251375,Alcalá de Henares (Madrid),1380187043821723648,61,26,[],El Gobierno no vacuna a los mayores de 70 pese a que soportan el 90% las muertes - ESdiario https://t.co/BoAo0mljsD
2021-04-08 15:53:21,manuelmuro5,2844239686,"Murcia, España",1380187013903740928,4,0,[],Las imágenes muestran que los picos son muy similares a los del virus y apoyan al adenovirus modificado utilizado e… https://t.co/GBx8eFwhdT
2021-04-08 15:53:20,manuelmuro5,2844239686,"Murcia, España",1380187011517198347,23,9,[],"Primera imagen de la proteína S de la COVID19 tras la vacuna, por 1@ vez las imágenes de los picos de proteínas que… https://t.co/qgu4kdXNHa"
2021-04-08 15:52:36,EuropaOlimpia,1375809810,Madrid,1380186824543510529,1,0,[],"@FLMIRONES @mariajesus4444 No. De los políticos no me fío ya antes de las vacunas.
Pero hay una presión mediática m… https://t.co/J5vl5RuZyq"
2021-04-08 15:52:34,ralmachuca,268991368,"Alcobendas, España",1380186815894851585,0,0,[],"@sanidadgob @CarolinaDarias @Defensagob Pero ministra , que sin astraceneca no se cumplen los plazos de vacunación,… https://t.co/qpV4IdyPTs"
2021-04-08 15:52:25,alcaladigital1,1609832360,Alcalá de Henares,1380186777764397056,0,0,[],Alemania negocia bilateralmente con Rusia la compra de la vacuna Sputnik lo contrario que ayer criticó Sánchez a Ay… https://t.co/kxtJJIgw1I
2021-04-08 15:52:24,larazon_murcia,727530524437258240,"Región de Murcia, España",1380186776485179392,0,0,[],Piden el cese de la consejera de Educación por “cuestionar” la vacunación contra la Covid https://t.co/BSMnpxOMLV
2021-04-08 15:52:09,ShardDoctor,2538748624,"Valencia, España",1380186714015207427,1,0,[],"@estoyguionisimo yo creo q lo has explicado muy bien ^^

El verdadero problema es quienes están metiendo miedo a la… https://t.co/Lz7dCtquKc"
2021-04-08 15:52:04,jatirado_oc,1034559695808356352,"Madrid, Comunidad de Madrid",1380186691223257088,2,3,"[{'text': 'AstraZeneca', 'indices': [0, 12]}, {'text': 'salud', 'indices': [13, 19]}]","#AstraZeneca #salud Vacuna de AstraZeneca: 7 síntomas de alarma para acudir al médico ""sin demora""… https://t.co/Z3NLDquULR"
2021-04-08 15:52:02,dp_domper,2520721306,"Sevilla, España",1380186681677123593,0,0,[],"@sanidadgob Con la confusión que se está creando no puede obligarse a nadie a vacunarse con AstraZ, pero a los que… https://t.co/NDVWxpmrYW"
2021-04-08 15:51:56,Martirios19,195476929,"Alicante, España",1380186657257840645,30,11,[],Aunque parezca mentira: es mas fácil morir deshidratado por exceso de pajas (0.000070 %) que de un trombo por la va… https://t.co/beqPsGX29u
2021-04-08 15:51:41,KmaradaKsanova,1174747547149242370,València,1380186595983306758,4,1,[],"@ccarballo50 @alfredocorell 2.- El miércoles 31/03, viendo que no mejoro voy a urgencias en hospital, indico  la re… https://t.co/gJfbKhDvYc"
2021-04-08 15:51:36,XRBustelo,930927867608948736,"Salamanca, Spain",1380186574437113861,404,118,[],"Una buena muestra de que, si todos nos movilizamos, se consiguen solucionar problemas. Gracias a los más de 260K tu… https://t.co/bZSlnxFsNA"
2021-04-08 15:51:31,ondacerogijon,202152587,Gijón,1380186551917891585,0,0,[],Alcaldesa @gijon pide mantener la prudencia pese a la relajación de las restricciones. Asegura que el Área V tiene… https://t.co/49iXmgLcaS
2021-04-08 15:51:26,s24horas,403281555,Salamanca,1380186533999828999,0,0,[],AMPLIACIÓN | Igea sobre vacunar con AstraZeneca a los mayores de 60: “El objetivo es concentrar el riesgo donde más… https://t.co/rZMpFc9gi8
2021-04-08 15:50:56,Dracamaniacos,913186244531822593,Xixón,1380186405314367493,0,0,[],"Castilla y León critica la negociación de Ayuso para comprar la vacuna rusa: ""Hacer estrategias en paralelo convier… https://t.co/CqL9qq8tHL"
2021-04-08 15:50:06,Pedro_Castro,18447733,Getafe,1380186194345144320,1,1,[],Mapa de vacunación en España por CCAA: 11.909.475 dosis entregadas y 9.357.847.administradas Las CCAA tienen 2.551.… https://t.co/u4bGsidcsF
2021-04-08 15:49:45,El_Enviado33,809103419495645184,"Valencia, España",1380186110211526660,1,0,[],"Pues que quereis que os diga...
Yo tengo 54 años y estoy deseando
que me pongan la segunda dosis de
Astrazeneca...… https://t.co/zYgsXpnDKr"
2021-04-08 15:49:40,marisierra59,3366308368,"Cabra, España",1380186086987685890,4,2,[],"@galarza_yaneth Buenas tardes mi Yaneth disfruta mucho de este día, perdona pero es que no me encuentro bien despué… https://t.co/KHFGyJ6tVB"
2021-04-08 15:49:36,MuyNegocios,1136556111673344000,"Madrid, Spain",1380186070340489216,1,0,[],Los retrasos en vacunación tienen un alto coste económico https://t.co/PtddAJ2KcS
2021-04-08 15:49:06,Scruzcampillo,331548343,Murcia,1380185944142274563,2,1,[],"La EMA encuentra “posibles vínculos” entre casos muy raros de trombos y la vacuna de AstraZeneca.

¿Cambia eso algo… https://t.co/TNUdHXcLHF"
2021-04-08 15:49:04,Joansinmiedo,15572962,"Madrid, Comunidad de Madrid",1380185936391192581,0,0,[],"«qué lío, si viajo a otro país de la UE ni sabría qué vacuna me toca» 😳"
2021-04-08 15:48:46,Richar_Swift,548696508,"Castilla-La Mancha, España",1380185862126850048,1,0,[],"@Scruzcampillo Esto crea desconfíanza y miedo en la población y sacar el lado un poco egoísta de,no quiero vacunarm… https://t.co/TRJibK8NUB"
2021-04-08 15:48:34,jatirado_oc,1034559695808356352,"Madrid, Comunidad de Madrid",1380185812269105153,1,3,"[{'text': 'Sociedad', 'indices': [0, 9]}, {'text': 'Educación', 'indices': [10, 20]}]",#Sociedad #Educación Centros educativos piden transparencia a Gobierno sobre la vacunación con AstraZeneca a docent… https://t.co/5fHXm18LYD
2021-04-08 15:48:21,EduLorenGarcia,140005190,"Madrid, Comunidad de Madrid",1380185756459732993,2,1,[],🏥💉🦠“Y a mí cuándo me toca”: la calculadora que te da la fecha en la que te vacunarás https://t.co/je2PdkxsX5
2021-04-08 15:48:18,IgnaciusBS,1075045317320560643,"Madrid, Comunidad de Madrid",1380185742060699652,3,0,[],"@Goorgo @GuilleGiles3 Gracias Jorge por cederle a mi padre tu puesto de vacunación contra el COVID, y tu seguir arr… https://t.co/thYJaVzp35"
2021-04-08 15:48:10,elgallegocabron,1103749898,Madrid,1380185709915570177,0,0,[],@elmundoes Exigimos a @pablocasado_ el cese de Ayuso por no preocúpese por la vacunación de gente dependiente de la… https://t.co/tdMAtREy4I
2021-04-08 15:47:54,donald_dpm,377419317,Madrid,1380185641200324612,5,3,[],"A mediados de enero de 2021 el 65% de las personas que morían en España tenían 80 y más años
---  
A mediados de ma… https://t.co/al8z1Ufj1e"
2021-04-08 15:47:51,AgusJProf,713282323,"Castilla y León, España",1380185629514997763,6,1,[],"@MAXIGJ ¿Ya llegó LA PREGUNTA?
- Si estoy vacunado con AstraZeneca y han suspendido la vacuna para los de mi edad,… https://t.co/Z5pX2ol09F"
2021-04-08 15:47:35,Diego_Rojo_,837329373325848576,"Valladolid, España",1380185563605663746,2,1,[],@Guscobos @jcyl @DiarioCyLMundo @nortecastilla @ValladolidCOPE @ocvalladolid @rne @la8valladolid @esRadio_Vall… https://t.co/YniBcSncUa
2021-04-08 15:47:16,Luisaguilar_es,818136604221050880,"Albacete, España",1380185481699328004,2,0,[],"Los beneficios de la vacunación siempre superan los riesgos, si no fuera así, no saldrían adelante las vacunas https://t.co/9hLL6iUwjd"
2021-04-08 15:47:10,MatiCapararo,160105062,Almagro,1380185459708596225,0,0,[],@SaltyAFboi @Emma_Magnus @MoniSanzCba @sanbarragan @Noraeye @UltimaLlamada_ Claro pero Chile son 18 millones y Urug… https://t.co/kUyG4qrzod
2021-04-08 15:47:00,DelGobEnAragon,809313915482083329,"Zaragoza, España",1380185415206981633,0,0,"[{'text': 'COVID19', 'indices': [67, 75]}]","💉 ¿Cómo actúa y en qué se diferencia cada tipo de vacuna frente al #COVID19?

🧪🧬🦠Conoce cómo funcionan las vacunas… https://t.co/YA92TqUYT1"
2021-04-08 15:46:56,RadioMadrid,246774887,Madrid,1380185397704200194,0,0,[],"Mónica García señala a Ayuso por ir ""por libre"" con la vacunación de AstraZeneca

https://t.co/5iaKnK8yUi"
2021-04-08 15:46:39,AngelMo15236035,1317542410562437121,San Sebastián/ Donostia ,1380185326539436037,1,2,[],"Las adenopatías axilares en el lado vacunado es una reacción previsible tras la vacuna COVID.
Consultar médico de A… https://t.co/JQShx5o0f7"
2021-04-08 15:46:16,msolsj,613233224,Lorca,1380185230968029185,0,1,[],@AlmelaRosauro @PSOE_RM El Gobierno de España ya ha comunicado a las CCAA que en abril la disponibilidad de vacunas… https://t.co/lbMCrTUfCe
2021-04-08 15:45:29,JosAlfo12870753,1084173794586042368,"Madrid, Comunidad de Madrid",1380185033567305730,0,0,[],@Vive_Carpe @jezquerra57 @_YolandaFuentes Si los políticos escucharan a los científicos no se habría montado todo e… https://t.co/XUxd0KMfXk
2021-04-08 15:45:24,La8Segovia,830883873944895492,"Segovia, España",1380185014323666945,0,0,[],AVANCE | ▶️ Se retoma la vacunación con AstraZeneca para los nacidos en 1956 y 1957. A las 19:55 se lo contamos en… https://t.co/319jjCpBpK
2021-04-08 15:45:22,mialfre,111350612,Madrid,1380185006157533184,0,0,[],"Por enterarme, la vacuna de AstraZeneca va mal para mayores de 65 años y para menores de 60 años. Mi conclusión es… https://t.co/yAXSMshAh7"
2021-04-08 15:45:10,josebarriomer,332145428,roldan - cartagena - españa,1380184955301597194,1,0,[],"@denavintage @regiondemurcia Al llamar, le habran dicho la vacuna que le ponen, supongo que sera alguien de riesgo,… https://t.co/zZJuVPdLlo"
2021-04-08 15:45:00,unicef_es,33173981,Madrid,1380184911785693188,13,9,[],Miles de niños y niñas se enfrentan cada día a enfermedades mortales que se pueden prevenir con una vacuna. Ayúdano… https://t.co/WPRJ9YxBdH
2021-04-08 15:44:31,Scruzcampillo,331548343,Murcia,1380184791958630405,7,4,[],"Actualicemos (porque si no se contextualiza, no es información, ya sabéis).

Efectivamente ha llegado el TERRIBLE D… https://t.co/5eqE3IKI9Q"
2021-04-08 15:44:29,Javi3rMTB,1227019249924923394,"Alicante, España",1380184783280562179,5,0,[],@AlexBal17090737 @elmundoes Yo te cedo gustosamente mi vacuna para sea usted la cobaya del veneno experimental que… https://t.co/l1X8oOPWQC
2021-04-08 15:44:25,virpb,955819130,Madrid,1380184767442862082,3,1,[],"entonces supuestamente no ponen Astra para poner la vacuna rusa, ahora Putín en vez de gas, nos venderá vacunas, si… https://t.co/6eHRQiVfrR"
2021-04-08 15:44:17,JJOLIVAN,244485430,Madrid,1380184732533678086,1,1,[],Bruselas niega que el plan de Alemania de comprar la vacuna Sputnik V ponga en riesgo la estrategia común y avisa a… https://t.co/H2wTVm9mxg
2021-04-08 15:44:03,JosAlfo12870753,1084173794586042368,"Madrid, Comunidad de Madrid",1380184673612140555,0,0,[],"@Vive_Carpe @jezquerra57 @_YolandaFuentes Si ahora no podemos aceptar el más mínimo riesgo en ningún medicamento, p… https://t.co/kwWyTrCS4q"
2021-04-08 15:43:21,qdiaz7,1585172850,"Sevilla, Andalucía",1380184498374123525,0,0,[],"Y luego continúan diciendo:
'Médicos y expertos explican que la vacuna de AstraZeneca es segura y que los beneficio… https://t.co/prqYSKyvEl"
2021-04-08 15:43:21,qdiaz7,1585172850,"Sevilla, Andalucía",1380184496629280773,0,0,[],"Leo este titular
'Suspenden la vacunación de AstraZeneca a menores de 60 años ""por un principio de precaución""'
Rea… https://t.co/t0OtJ3lbtS"
2021-04-08 15:43:17,isi_do_ro,876391813648715776,"Andalucía, España",1380184481382993921,0,0,[],@japrietov @Juliaenlaonda @carlos__alsina @MasDeUno @HerreraenCOPE @La_SER @radio5_rne @EPeducacion os informamos d… https://t.co/zQohbiQBUr
2021-04-08 15:42:53,dp_domper,2520721306,"Sevilla, España",1380184382019940355,0,0,[],@antonlosada @elperiodico Con la confusión que se está creando no puede obligarse a nadie a vacunarse con AstraZene… https://t.co/Qr6pQgJKnC
2021-04-08 15:42:52,MercheCalvo3,985468646842667008,España,1380184375279636485,10,0,[],"@telecincoes Inocularte una bakuna creada a toda prisa, aún sin saber ni los peligros que comporta para humanos, ..… https://t.co/qFx8Qqi4JP"
2021-04-08 15:42:51,RadioCentroAv,968887926825410561,"Ávila, España",1380184373190926342,1,0,"[{'text': 'Ávila', 'indices': [37, 43]}]","ATENCIÓN
Se reanuda la vacunación en #Ávila

Si has nacido en 1956 y 1957 y eres de las ZBS de:
- Ávila capital y r… https://t.co/iZtZGXlFr0"
2021-04-08 15:42:49,kepasa29,208156207,Donostia,1380184363124539395,0,0,"[{'text': 'Soberana02', 'indices': [67, 78]}]",¿Qué vacuna del coronavirus me toca según mi edad? 👈🏽 Yo quiero la #Soberana02  https://t.co/bPK2Dc5pxn
2021-04-08 15:42:38,doctorchuslolo,267879697,,1380184318677487620,5,0,[],@Viki_Ortiz @rrarroca Solo con la dilación en el proceso de vacunación estimó que habrá más fallecimientos por Covi… https://t.co/nIrlhh49NM
2021-04-08 15:42:36,bolsamania,61307129,Madrid,1380184308590252041,2,0,[],"🟢 Los valores que más suben son Grifols (+4,51%) y Solaria (+3,27%)
🔴 Los títulos que más caen son Repsol (-2,58%)… https://t.co/384PthD2T5"
2021-04-08 15:41:31,doctorchuslolo,267879697,,1380184037331980288,3,0,[],@Viki_Ortiz @rrarroca lo que digo es que la gente tiene miedo a una vacuna y no tiene miedo a consumir ordinal . Es la diferencia .
2021-04-08 15:41:28,Drandreaguilera,770607012,Milagro,1380184024119963652,5,1,[],"Segunda dosis de la vacuna SINOVAC, Dios es bueno, a seguir trabajando para ganar la lucha al Covid-19... https://t.co/kCFKnzFirF"
2021-04-08 15:40:41,monicasm12,982964821,"Talavera de la Reina, España",1380183826417221632,1,0,[],"Y a los que ya se lo han puesto obligados casi, que pasa ? A qué estáis jugando? Somos conejillos de indias, es ver… https://t.co/Rp2LusgCif"
2021-04-08 15:40:38,RondadorNJ,3002839113,طليطلة,1380183812676681737,1,0,[],"@estoyguionisimo Pienso exactamente igual. A mí me da igual ponerme una vacuna u otra, pero quien tenga ciertos pro… https://t.co/JE2paLAiWn"
2021-04-08 15:40:18,COPE,9706822,"Madrid, Comunidad de Madrid",1380183728916430854,8,5,[],Los medicamentos y fármacos con más efectos secundarios graves que la vacuna de AstraZeneca https://t.co/mv5LAwtz58
2021-04-08 15:40:10,bolsamania,61307129,Madrid,1380183698310586369,5,2,"[{'text': 'Cierre', 'indices': [0, 7]}]","#Cierre | El Ibex consolida los 8.600 puntos impulsado por Grifols, Iberdrola y Ferrovial
https://t.co/1L78Aof820 https://t.co/6l4AynyUi2"
2021-04-08 15:40:00,ideal_jaen,193626721,Jaén,1380183654085783553,0,0,"[{'text': 'Coronavirus', 'indices': [2, 14]}]",⚠ #Coronavirus La Agencia Europea del Medicamento ha difundido una relación de efectos secundarios de la vacuna de… https://t.co/UnggIyLwWg
2021-04-08 15:40:00,csinformacion,963389028,Castellón (Spain),1380183653683056640,0,0,"[{'text': 'LoMásLeído', 'indices': [0, 11]}, {'text': 'AstraZeneca', 'indices': [67, 79]}]","#LoMásLeído: España y las autonomías acuerdan tan solo vacunar con #AstraZeneca a personas entre 60 y 65 años 

https://t.co/QfSTdJHyfl"
