0,1,2,3,4,5,6,7,8
2021-04-08 13:14:31,DBTenLaEscuela,216048673,"Avilés, España",1380147042694135810,0,0,"[{'text': 'AstraZenaca', 'indices': [72, 84]}, {'text': 'segundadosis', 'indices': [85, 98]}, {'text': 'COVIDー19', 'indices': [99, 108]}]",Preocupada por la segunda dosis de la vacuna con una braga en la cara🤔🤪 #AstraZenaca #segundadosis #COVIDー19 https://t.co/y9BMAi5f8B
2021-04-08 13:14:24,gmorfer,183306887,Sevilla,1380147012629315589,3,2,[],@josemoredue @Alvaradoblog @AndaluciaJunta Y poniendo farolillos en las calles! ¿De verdad no aprenden?? Hay más re… https://t.co/4VbqOFO6G1
2021-04-08 13:14:16,horaciolupi,281029609,Madrid,1380146979787976705,0,0,"[{'text': 'covid', 'indices': [32, 38]}]","En España mueren ahora mismo de #covid aproximadamente 26 personas cada día.

Y aquí estamos, parando la vacunación… https://t.co/3rEOg1Lc6h"
2021-04-08 13:13:55,SaDiario,1653001062,Salamanca,1380146893519523842,0,0,[],Suben los casos de covid-19 en Castilla y León y se retoma la vacunación con AstraZeneca - Salud a Diario… https://t.co/k6n9XQX1hm
2021-04-08 13:13:49,carlosfg49,1485451332,"Zaragoza, Aragón",1380146868034887681,3,0,[],"Las noticias de la vacunacion, me dejan más tranquilo. ¡ Socorro !"
2021-04-08 13:13:38,mjlalatina,246700510,madrid,1380146818315599872,0,0,[],"@ccarballo50 Sinceramente usted cree que en condiciones normales y con la legislación del medicamento vigente, está vacuna se mantendría?"
2021-04-08 13:13:37,Alvaradoblog,192322529,Sevilla,1380146817627783171,5,1,[],Viendo lo que está sucediendo con la vacuna de Aztrazeneca y los bandazos que se están dando desde @sanidadgob (igu… https://t.co/jYvwUXpzbN
2021-04-08 13:13:30,gusfb69,1521985286,Avila,1380146785629433865,0,0,[],@sanidadgob  antes y según la farmacéutica AstraZeneca su vacuna eran 2dosis para adquirir el 70% de inmunidad y ah… https://t.co/nAlSm4d8Hf
2021-04-08 13:13:24,mikemoratinos,460030420,"Valladolid, Castilla y León",1380146762825015301,10,1,[],Sinceramente creo que aquí en España deberían hacer como en Italia...vacunar con AZ a los que ya han recibido la pr… https://t.co/ivG3PS26iS
2021-04-08 13:12:43,joseantoniogaba,322721720,"Córdoba, España",1380146587649851403,1,0,[],"Una señora hablando de la vacuna con una mascarilla de rejilla, señora no le va hacer falta la vacuna"
2021-04-08 13:12:39,Abanonirujo,235312439,Pamplona,1380146573586358272,38,16,[],12 casos de trombos de 2.000.000 de vacunados. ¿Se puede gestionar peor el tema de AstraZeneca? ¿Podría alguien lid… https://t.co/UhTfC9JE3d
2021-04-08 13:12:38,heraldoes,15581283,"Aragón, España",1380146568519630851,8,8,[],❗Defensa suspende la vacunación para los militares y civiles en las unidades de Zaragoza https://t.co/gOUXRufA6N
2021-04-08 13:12:14,martinapoita,864948116927197184,"Madrid, Salamanca",1380146467856379904,5,1,[],"Hay que tener mucho cuidado con la vacuna de AstraZeneca porque hay un 0,0007% de probabilidad de un trombo."
2021-04-08 13:11:51,virpb,955819130,Madrid,1380146369692905475,3,1,[],"Ya han vacunado en media España a sanitarios y policías con Astra Zeneca, y ahora van y suspenden la vacunación,… https://t.co/ITPb0SP4sd"
2021-04-08 13:11:40,jcuecam,217779492,España,1380146325514285065,0,0,[],La incompetencia de la autoridad sanitaria en España es manifiesta al saltarse las recomendaciones de la Agencia Eu… https://t.co/OqF7gAEUI8
2021-04-08 13:11:17,Pintxo,19065481,"Madrid, Spain",1380146227682103301,0,0,[],Los rusos frotándose las manos -&gt; Alemania abre el camino para que los países compren vacunas al margen de la Unión… https://t.co/vAACnWWjJA
2021-04-08 13:11:09,CesarMBGEH,247737039,"Madrid, España",1380146195692130306,7,0,[],Yo lo siento pero si aprueban que la segunda dosis sea de otra vacuna no creo que me la ponga. Experimentos con rat… https://t.co/7ky3IBhBYq
2021-04-08 13:11:03,diariosevilla,34238668,"Sevilla, Spain",1380146170060795909,1,0,[],Este es el perfil de las personas que han sufrido trombos con la vacuna de AstraZeneca https://t.co/f6WJdXrafI
2021-04-08 13:11:02,eldiarioclm,2176804050,"Toledo, España",1380146165400924163,0,0,[],"¿Quieres saber cómo va el ritmo de vacunación en Castilla-La Mancha? Aquí te ofrecemos día a día todos los datos 👇

https://t.co/cw8rr9HhjE"
2021-04-08 13:11:00,informativost5,16514160,Mediaset España,1380146156504760322,2,5,[],"Cataluña abre una investigación para determinar las causas de la muerte de un vecino de Tàrrega, que falleció dos h… https://t.co/jBy2d2uHpZ"
2021-04-08 13:10:58,martinapoita,864948116927197184,"Madrid, Salamanca",1380146147138940932,0,0,[],"@FGRoNNeR @SebyPalermo @dua_elbousnani @vii15_ Los “casos” son eso, CASOS, los seguirá habiendo hasta el fin del mu… https://t.co/bni7tACJhl"
2021-04-08 13:10:34,AgenciaIcal,704958229,Castilla y León,1380146046932815873,1,0,[],.@FranciscoIgea pide disculpas “por las molestias” pero defiende la decisión “prudente” de la @jcyl de suspender la… https://t.co/eqe279gwAr
2021-04-08 13:10:30,Sennih022,2751535107,"Ciudad Real, España",1380146032303030274,0,0,[],"@TxominNorris @usuarioousuaria @Alex_EFESE @navedelmisterio Lo del brazo me pasa con la vacuna de la gripe, y ahora… https://t.co/6n3lwZwNzi"
2021-04-08 13:10:16,Cursedwind,604970146,Alicante,1380145974065172481,24,0,[],"Mi madre: Alfonso! Ya sé que vacuna me van a poner!
Yo: Hostias mamá, cual?
Mi madre: Marca Blanca! La de Hacendado… https://t.co/qKNJuQJxRv"
2021-04-08 13:10:03,santi1407,373708111,Valladolid,1380145919371411464,0,0,[],"@H2Pucela @AyuntamientoVLL @oscar_puente_ Si, por eso el comité de expertos de Castilla y León, se ha desentendido… https://t.co/LCJgof0BpT"
2021-04-08 13:10:03,musicazul,66369359,Madrid,1380145917664301060,1,1,[],"[Noticias]

@WiZinkCenter comienza con la vacunación este viernes. ¡La campaña está dirigida por la Consejería de S… https://t.co/sTujlcecAG"
2021-04-08 13:09:43,rosagarciacab,480741116,"Andalucía, España",1380145833472036865,1,0,[],Escuchar la incredulidad y la incertidumbre en las conversaciones callejeras ante la última decisión sobre la vacun… https://t.co/fREVVfXwum
2021-04-08 13:09:41,CesarMBGEH,247737039,"Madrid, España",1380145824504627205,1,0,[],"Vacuna de AstraZeneca: prudencia, sí; miedo, no  https://t.co/Rzg7mM9U5r vía @el_pais"
2021-04-08 13:09:21,AytoArroyo,257413508,Valladolid,1380145742371819523,3,0,[],La Junta reanuda hoy la vacunación con AstraZeneca en el Miguel Delibes con el calendario establecido anteriormente. https://t.co/uLcWiyZ5HZ
2021-04-08 13:09:20,Adrian_V21,501852767,"Madrid, Comunidad de Madrid",1380145739377090561,0,0,[],@Shamayim2 @navedelmisterio Dale Ibuprofeno a millones de personas diferentes durante un mes... A ver cuántos te ll… https://t.co/GzpfHX6l9q
2021-04-08 13:09:05,univerzee,27904554,"Valencia, España",1380145674189217794,0,0,[],"Cuando se comunica mal, todo puede acabar en desastre. Nadie explicando que el ratio morir sin vacuna para ese inte… https://t.co/UgzMEObAvk"
2021-04-08 13:09:03,RadioFraga,356082934,"Fraga, Huesca",1380145667373404162,0,0,[],🎙 NOTICIAS | Salud Pública notifica 9 positivos por covid en Fraga el martes 🔹 Aragón inicia la vacunación a las pe… https://t.co/M6esBIobFg
2021-04-08 13:08:37,_manxam_,145013679,Logroño,1380145557612736515,1,0,[],"A algunos nos toca la segunda dosis en dos semanas, eso de que no hay prisa lo dirá usted.
https://t.co/cEFDgi2igD"
2021-04-08 13:08:32,JavierFdzS,372845160,Madrid (España),1380145534971883523,0,0,[],"A ver,la vacunación no se ha parado,quedan millones de personas &gt;60 años por vacunar. Luego está lo del ejemplo del… https://t.co/YHrVtv8RcS"
2021-04-08 13:08:21,MarianObiol,1032195608214470657,"Valencia, España",1380145490789011461,11,0,[],"No compareis, no es el mismo balance  riesgo-beneficio en una vacuna que en un anticonceptivo.
Y si creéis que ese… https://t.co/H5NHLb23MK"
2021-04-08 13:08:19,Toni_F7,301149659,"Ciudad Real, España",1380145482375258115,1,0,"[{'text': 'astrazeneca', 'indices': [97, 109]}, {'text': 'vacunacion', 'indices': [110, 121]}, {'text': 'españa', 'indices': [122, 129]}]",¿Y por qué no usan todas las vacunas de AstraZeneca para vacunar a todos los políticos del país? #astrazeneca #vacunacion #españa
2021-04-08 13:08:18,x459_x,1379558027821527040,Madrid,1380145478797570052,0,0,[],@Shalom79185531 @elmundoes Esta vacuna y todas.
2021-04-08 13:07:58,Ccalvocastro,255663125,Madrid,1380145394169040897,0,1,[],"@gorka_orive Mi mujer es enferma de Chron y tiene hemocromatosis, está en tratamiento con infliximab desde hace 2 a… https://t.co/ZDb1Bo3kzD"
2021-04-08 13:07:48,Pizarro25051,1335300524535582722,,1380145353220055042,0,0,[],"Haber señora Ayuso, pero es que se a vuelto usted loca ?,  Pero como se va ha fiar ahora de los Rusos y precisament… https://t.co/7isoB0eun4"
2021-04-08 13:07:42,MozoYefimovich,403063161,"Mérida, España",1380145327412498432,4,1,[],Claramente un fake para colarnos la vacuna. Con ese brazo antes se rompe la punta de la jeringuilla que penetrar en… https://t.co/wp8a06wc5P
2021-04-08 13:07:33,radiotarancon,236867889,"Tarancón, Cuenca",1380145289353396232,0,0,[],Anulada la vacunación con AstraZeneca para los menores de 60 https://t.co/zb0PYUhhvO a través de @SER_Toledo
2021-04-08 13:07:22,msanzjulia,321301312,"Comunidad Valenciana, España",1380145242263932929,0,0,[],La ministra ha dicho que se mantiene la vacunacion de un seixetenta % de la población
2021-04-08 13:07:22,Mikelmi38277537,1248619414737391620,"País Vasco, España",1380145241647423488,2,0,[],@JesyFux @fans_apolonia Tomando la vacuna
2021-04-08 13:07:12,marxiniano,179597617,Murcia,1380145199918235650,0,0,[],"La vacuna AstraZeneca se podría administrar a quién, con la edad correspondiente, la acepte voluntarianente."
2021-04-08 13:06:56,costadulcefm,884176340,Orellana la Vieja,1380145134633955330,0,0,[],💉 Continúa la vacunación con AstraZeneca en el Centro de Salud de Orellana para la población diana de entre 60 y 64… https://t.co/jhQlrwbJ1w
2021-04-08 13:06:55,RubenRmrez,410833946,"Castellón de la Plana, España",1380145128946475012,1,0,[],Maravillado con el “ratas a la carrera” que se está produciendo para hacerse con la vacuna Sputnik. Que igual lo su… https://t.co/uDdz1mDa4i
2021-04-08 13:06:48,pparanjuez,122340303,Aranjuez,1380145098969714689,4,2,[],"🔵🔵  Buenas noticias. A partir de este fin de semana , el Hospital del Tajo se incorpora a la estrategia de vacunaci… https://t.co/U9mIg4lPc2"
2021-04-08 13:06:41,el_adelantado,44934709,Segovia (Spain),1380145069756456964,0,0,"[{'text': 'CastillayLeón', 'indices': [2, 16]}]",🔵 #CastillayLeón | La Junta pide disculpas por parar la vacunación con AstraZeneca y lo achaca a la “no decisión” d… https://t.co/CfY0oHvMjz
2021-04-08 13:06:21,SantiMoralesA,600411890,"Comunidad de Madrid, España",1380144988730822663,0,0,[],@elisabeni @paridator @BelenBerruezo @racartrom @el_pais Por cada millón de vacunados con AstraZeneca se evitarían… https://t.co/Kp6wexJH97
2021-04-08 13:06:04,anaimana_ana,3028208614,"Lardero, España",1380144916106510337,0,0,[],Yo no quiero vacuna de astrazeneca Que se la pongan ellos
2021-04-08 13:05:56,pacoredondo,239050967,"Asturias, España.",1380144881096622084,0,0,[],"Suspensión de la vacuna AstraZeneca a menores de 60 años, sin saberse qué pasará con los 2 millones que ya han reci… https://t.co/OkZzege09j"
2021-04-08 13:05:35,pablogimenobell,259756775,"Comunidad Valenciana, España",1380144796493307910,3,0,[],"Bueno @sanidadgob decidís paralizar la vacunacion con Astrazeneca, paralizad la venta de los medicamentos (anticonc… https://t.co/qHtxsYiuqt"
2021-04-08 13:05:31,cricriripoll,1136889056200204288,Murcia,1380144776562028550,0,0,[],todo lo que avanzamos ayer en la vacunación es lo que no hacemos hoy
2021-04-08 13:05:24,Pepin37117116,1119959825251749889,,1380144746333675529,0,0,[],@rtvenoticias ¿ Como vamos a confiar en la vacunacion en Europa si ningunean en Turquía  a su presidenta y no pasa… https://t.co/g9f5YVhd8h
2021-04-08 13:05:07,TemporaAeterna,3841769656,"Sevilla, España",1380144676108386305,8,2,[],"Madrid, Valencia y Andalucía negociando con farmacéuticas por su cuenta.
Austria, Eslovaquia y Alemania negociando… https://t.co/p5Fjq9IPgm"
2021-04-08 13:04:57,albeeer_tosqui7,257579992,Badajoz,1380144636941963269,0,0,[],"@Torren__ Os toca mamar y estar calladitos 😂 no hay mayor pandemia que el antimadridismo, que para eso no hay cura ni vacuna"
2021-04-08 13:04:28,radioguijuelo,218868359,Guijuelo,1380144512580907010,0,1,[],"Se reanuda la vacunación con AstraZeneca para personas entre 60 y 65 años
 https://t.co/aQ9s8tSu1K https://t.co/pJqs5VwYhk"
2021-04-08 13:04:23,edugi94,156610306,València,1380144492922163203,0,0,[],La mierda de producto que debe de ser la vacuna AstraZeneca para que paralice su vacunación con la de intereses y d… https://t.co/Ttd8lZkhdu
2021-04-08 13:03:45,_jorgegd_,248472135,"Comunidad de Madrid, España",1380144333161136136,0,0,[],@xavigmm Nadie se jode. La estrategia de vacunación es bastante equitativa y está posibilitando que alguien en un b… https://t.co/D1MxKWHnbo
2021-04-08 13:03:25,AranchaArribas,340867640,"Valladolid, España",1380144250906681346,5,1,[],@nachorosell @chuchencio Me costó dios y ayuda que mi madre se pusiese el lunes la vacuna por todo el revuelo que y… https://t.co/ulMSRrxBQC
2021-04-08 13:03:04,11Lucas09,3056790844,Madrid,1380144159097511951,1,0,[],"Nah si alfinal me ponen la vacuna rusa y todo, messirve 😂 https://t.co/pKCIJi7TGo"
2021-04-08 13:03:02,ignacio_sillo,982836176,El mundo,1380144152764092416,0,0,[],"Se consuma el fracaso de la compra colectiva Europea... habrá dimisiones en la @EU_Commission ? No creo 
https://t.co/aj3nqzWETO"
2021-04-08 13:02:37,Lisugi,215256063,"Madrid, Spain",1380144048032350227,0,0,[],@antonlosada @GobiernoDeEspan No poner la segunda dosis o ponerla con una vacuna diferente puede tener más riesgos en mi opinión.
2021-04-08 13:02:13,gamusinosgratis,1038339521459445760,"Castilla y León, España",1380143945393582082,0,0,[],"@TribunaVa Y mientras tú retrasas la vacunación, yo tengo mi negocio cerrado, basta ya!"
2021-04-08 13:02:12,poper66,290486800,,1380143941224443912,0,0,[],"Ministra eso ya se sabe, primero debe ser aprobado por la EME, y luego comprar, quién ha dicho lo contrario,  decir… https://t.co/Yw4Q4I1cvB"
2021-04-08 13:02:06,Jc_seat1400,169102652,"Madrid, Comunidad de Madrid",1380143919216922627,1,1,[],@arriramaria @ComunidadMadrid Para ver el funcionamiento de vacunación y ver cuál es mejor vacunando. https://t.co/UVTCynv39x
2021-04-08 13:02:02,sotomfm,1405929576,"Comunidad de Madrid, España",1380143901751848961,0,0,[],"@ccarballo50 Mantengo mi opinión... ni ayer ni hoy ni mañana, ni con las tucas me pongo esa vacuna! Puro ensayo y error 🤦🏻‍♀️"
2021-04-08 13:02:01,labrujulacala,407720452,Calahorra (La Rioja) España,1380143898899722245,0,0,[],Suspendida la segunda dosis de la vacuna con AstraZeneca para 12.179 riojanos mientras prosigue para la franja de 6… https://t.co/7QEquvaX9C
2021-04-08 13:02:01,ElDigitalAB,1219839072,"Albacete, España",1380143898442539009,0,1,[],Sanidad autoriza estos dos lugares en La Roda y Villarrobledo como Servicios de Vacunación Centralizada - https://t.co/yN3cmqs1ku
2021-04-08 13:01:44,Elmedicoint,368211069,Madrid ,1380143826774454272,1,0,"[{'text': 'Internacional', 'indices': [0, 14]}, {'text': 'virus', 'indices': [76, 82]}, {'text': 'COVID', 'indices': [89, 95]}, {'text': 'vacuna', 'indices': [107, 114]}]","#Internacional 🌎 Consiguen las primeras imágenes de la proteína de pico del #virus de la #COVID-19 tras la #vacuna
https://t.co/66Sxx1bmK8"
2021-04-08 13:01:41,RoberVCF_,251321871,"Comunidad Valenciana, España",1380143811251351556,12,0,[],"Si prohíben la vacuna AstraZeneca, ¿por qué no prohíben la píldora?"
2021-04-08 13:01:31,ibontxuelo,1903675596,"Vitoria-Gasteiz, País Vasco",1380143771627745282,0,0,[],"@gorka_orive Yo hago una pregunta desde la ignorancia? Todo medicamento tiene contraindicaciones, para tanto es lo… https://t.co/EtVSSNPr0v"
2021-04-08 13:01:18,asturies,15994704,Asturies,1380143717567324164,0,1,[],"Les terraces van tar abiertes hasta les 23 hores dende'l sábadu y los interiores, hasta les 21.

El miércoles rexis… https://t.co/xWAJhNfVPx"
2021-04-08 13:01:17,eladioillan9,212524568,"Alicante, España",1380143712232206343,1,0,[],En esto de la vacuna de AstraZeneca no descartaría nada. Ni tan siquiera que pueda obedecer todo a una campaña conc… https://t.co/nTeZbQtLmK
2021-04-08 13:01:16,jm_cor1,2680186247,Sevilla,1380143707891056647,7,0,[],no queremos la vacuna queremos tener ya todos los discos regrabados de taylor
2021-04-08 13:01:05,jorgitoramos22,314117757,Fuenlabrada (Madrid),1380143662525341698,2,0,[],"Hola @sanidadgob, ¿no cabría la posibilidad de poner la vacuna de AstraZeneca a menores de 60 años que quieran volu… https://t.co/mwuh9qLpHA"
2021-04-08 13:01:05,msalaet62,1928046788,TORTOSA,1380143660222836741,0,0,[],"@BsBelindabs @FLMIRONES Quien quiera vacunarse que se vacune, y quien no quiera que le respeten. Que riesgo va a te… https://t.co/E08221UJxb"
2021-04-08 13:01:00,el_pais,7996082,Madrid,1380143640648036352,52,21,[],Alemania está dispuesta a negociar un contrato bilateral con el fabricante de la vacuna rusa Sputnik V una vez reci… https://t.co/e89Csh4JwD
2021-04-08 13:00:58,JosAlfo12870753,1084173794586042368,"Madrid, Comunidad de Madrid",1380143631630229506,1,0,[],@Vive_Carpe @jezquerra57 @_YolandaFuentes Ya te he respondido antes a eso. Cualquier retraso en la vacunación costará muchas vidas.
2021-04-08 13:00:58,laura_m2,410257698,"Madrid, Comunidad de Madrid",1380143630548135942,3,0,[],@pbeltranp Gattaca sería la evolución. Esto un primer paso. Es empezar a ver aceptable restringir o conceder libert… https://t.co/O8V9bvdjer
2021-04-08 13:00:53,ESA_Madrid,3457658301,"Madrid, Comunidad de Madrid",1380143611384377344,0,0,[],"A favor de la recuperación, y siempre con cautela, juegan las ganas de la población por viajar y la recuperación de… https://t.co/BAfVEuCJnB"
2021-04-08 13:00:50,CopeZaragoza,2238989226,"Zaragoza, España",1380143599594176513,0,0,[],📻  🔊 | ¿Y qué tienen que decir los expertos sobre la vacuna de AstraZeneca? ¿Segunda dosis 'sí' o 'no? Puedes escuc… https://t.co/O9RiUdM0So
2021-04-08 13:00:50,omeuxeito,69343508,Madrid,1380143599493464067,6261,2571,[],"Si la probabilidad de sufrir un trombo tras una vacuna de AstraZeneca es 1 de un millón, vacunando con ella a TODA… https://t.co/cijbLdQoBC"
2021-04-08 13:00:48,karola_pons,3400891054,Madrid,1380143588709916672,0,0,[],"LA VERDAD NO TIENE LUGAR PARA LOS VERIFICADORES DE FAKEBOOK...
https://t.co/OOYSlv3SFK"
2021-04-08 13:00:34,AresRzG,2467936536,Madrid,1380143530438389764,0,0,[],Facebook lanza sus marcos de perfil oficiales en apoyo de la vacunación anti Covid-19 https://t.co/WgswNdEgWG https://t.co/mGhBwKeHma
2021-04-08 13:00:17,SantiMoralesA,600411890,"Comunidad de Madrid, España",1380143461517701122,0,0,[],"@elisabeni @BelenBerruezo @racartrom @el_pais Pero no podemos elegir, que no hay más. Que suprimir una vacuna supon… https://t.co/DvxYXT3hj3"
2021-04-08 13:00:16,funeshoy,591822329,Funes,1380143457633714184,0,1,[],La Secretaría de Salud de Funes presentó un informe actualizado https://t.co/xriZs7rRoW Luego de que el Presidente… https://t.co/YO8qpUHZ6y
2021-04-08 13:00:07,taexpon,72464860,"Valencia, Spain",1380143418886721539,2,0,[],@rafa_79_av @TheLancet El problema que le veo yo es que si la vacuna está diseñada para necesitar un refuerzo (segu… https://t.co/1mrCYlPNVk
2021-04-08 13:00:03,SERMadridSur,111043197,Madrid,1380143402239418372,0,0,"[{'text': 'Getafe', 'indices': [91, 98]}]","La Plataforma de Centros de Salud de Madrid ha presentado su Plan de Vacunación cercana en #Getafe

https://t.co/7C7tr1UYNH"
2021-04-08 13:00:01,informacion_es,92002486,"Alicante, España",1380143395306373120,2,0,[],Hosbec pide diligencia para hacer compatible el calendario de vacunación con las vacaciones de verano https://t.co/EtFwu8fWoV
2021-04-08 13:00:01,HoraJaen,2841209698,Jaen,1380143393691459585,2,2,[],JAÉN | La Diputación se ofrece a colaborar en la financiación de los desplazamientos de los sanitarios a los lugare… https://t.co/MWKsIit7hu
2021-04-08 13:00:00,T_interesa,246257746,"Madrid, ESPAÑA",1380143390013206530,0,0,[],Ayuso y Casado acusan a Sánchez de uso partidista de la vacunación y se desmarcan de la suspensión: «hay que vacuna… https://t.co/dahJHPEg7r
2021-04-08 12:59:58,fpontcasellas,971580727,"Madrid, Spain",1380143382253735937,0,0,[],"@toniicaria @tytoelgambi @JosepNada @iguardans ¿De qué fármaco está hablando? ¿Se refiere a la tecnología mRNA, que… https://t.co/SJnAnzUq3b"
2021-04-08 12:59:47,hugomabarca,17138110,Madrid,1380143336493834241,15,7,[],Es difícil comprender la base científica y sanitaria que lleva a paralizar (o al menos recortar tanto) el proceso d… https://t.co/gE2JxhPg4Z
2021-04-08 12:59:44,joseluismap,501590974,Majadahonda,1380143323936096262,0,0,[],Temor en el sector turístico: los plazos de vacunación ponen en juego el verano y la llegada de británicos -… https://t.co/J2FOb88ykY
2021-04-08 12:59:42,Darckman64,489777724,Burjassot-Valencia-España,1380143313626488840,0,0,[],La aparción de noticias acerca de los casos puntuales de accidentes tromboembólicos en personas que han sido vacuna… https://t.co/Hh53y8vTME
2021-04-08 12:59:17,joseluismap,501590974,Majadahonda,1380143209310007296,0,0,[],Coronavirus: De la aspirina a la píldora: 5 fármacos habituales más 'peligrosos' que la vacuna de Astrazeneca -… https://t.co/Z27PTMAJXO
2021-04-08 12:59:15,pmorafigueroa,314652184,"Sevilla, España",1380143201361801225,4,3,[],"@GquirogaGonzalo Yo me apunto a la Vacuna de Astra Zeneca q no van a poner,mañana mismo. Q me digan donde. Como sie… https://t.co/3PtopRkHIc"
2021-04-08 12:59:09,PDeclan,146932869,"Cuenca, España",1380143173457096705,2,0,[],"@semevadlalengua No, al revés. Lo que hay es una recomendación para vacunarse, incluso con las dudas sobre la moral… https://t.co/ACO81qI7th"
2021-04-08 12:59:07,jmarques39,263623293,"Madrid, Comunidad de Madrid",1380143165253029890,1,2,[],Europa se ha convertido en una sociedad de responsabilidad limitada. Sus miembros tienen bien merecido el vodevil c… https://t.co/1azRi28Eik
2021-04-08 12:59:06,alvmad1985,2537793070,"Madrid, Comunidad de Madrid",1380143164061802496,0,0,[],@CarolinaDarias @sanidadgob La has liado muy parda con la vacuna AstraZeneca y no dices ni mu y la gente está muy confusa y molesta
2021-04-08 12:58:59,AlcalaHoy1,1641190098,Alcalá de Henares,1380143133829300226,20,10,[],Ciudadanos (Cs) Alcalá reclama a Díaz Ayuso la incorporación inmediata del Hospital Príncipe de Asturias como centr… https://t.co/rszWsJY83X
2021-04-08 12:58:50,Rodriikkk,1076562443533467648,"Alcalá de Henares, España",1380143095354900484,0,0,[],"La base general de la vacunación está en manos de la UE, y así debe ser.

Pero necesitamos un extra, y gestionarlo… https://t.co/xfEqXrh44b"
2021-04-08 12:58:42,OjedaCosme,405035553,Madrid,1380143062928740354,4,2,[],"Monitorizar cómo evoluciona la vacunación real frente a lo prometido.
Desde hoy, en la web 
https://t.co/ohsREVsv2p https://t.co/RLWhb6wbGL"
2021-04-08 12:58:41,joseluismap,501590974,Majadahonda,1380143057241321478,0,0,[],El correo que desmiente a la Generalitat: así se anuló la vacunación de policías y guardias civiles -… https://t.co/HPYMeJ8WaS
2021-04-08 12:58:10,RosaMartinal,327874493,Madrid,1380142929516367874,3,0,[],"@nmunozm No sé cómo me siento ahora mismo: si decepcionada, desesperanzada, cabreada...
Camino de la cuarta ola y s… https://t.co/90Kob93Pz4"
2021-04-08 12:58:07,Pilarcillavt,369090281,"Granada, España",1380142917298352128,1,0,[],@haize_m 🙋🏻‍♀️ yo también quiero la vacuna. Me presento voluntaria ya
2021-04-08 12:58:01,OndaCeroRadioCr,917978126960951297,"Ciudad Real, España",1380142890333114368,1,3,[],"@SanidadCR @SanidadCLM Juan Castell: ""Suspender AstraZeneca es un lío. O nos damos prisa en la vacunación o el viru… https://t.co/ntONcjMGZW"
2021-04-08 12:57:59,Juan58402113,990757430471557125,"Mirasierra, Madrid",1380142879780319232,4,0,[],"@MG_acupuntura Militarización, estados de alarma. Se empieza a probar la vacuna, las farmacéuticas se forran...es una peli profética"
2021-04-08 12:57:48,CConejoCarmen,4491883515,"Sevilla, España",1380142835467362306,0,0,[],No tiene ningún sentido que suspendan la vacunación  en la franja de edad entre 55 y 60 años por un efecto adverso… https://t.co/fzyd9Yq6XF
2021-04-08 12:57:23,Rodriikkk,1076562443533467648,"Alcalá de Henares, España",1380142732312780803,0,0,[],"Si es con una vacuna extra, sí. Quién pueda y quiera.

La UE va demasiado lenta. No necesitamos politicuchos de des… https://t.co/UvUB7HQ0eH"
2021-04-08 12:57:15,jpabloma,222544624,Madrid,1380142695901970432,0,0,[],@pepeblai @Lucy_in_Firenze Aparentemente lo están: eso he oído esta mañana. El otro escenario es poner otra vacuna… https://t.co/G3mPzfbyho
2021-04-08 12:57:13,avq_1979,707947556458930178,"Seville, Spain",1380142688754864133,1,0,[],"Muere una persona que fue al cine...y así todo.

El que no quiera vacuna, que corra turno. https://t.co/2bcaLllt5G"
2021-04-08 12:57:04,Bertoltbrecht36,986635437178544128,Euskal Herria,1380142652725813250,60,22,[],"Vacuna AstraZeneca: 7 muertos (sin confirmar la relación directa)  por cada 18 millones de vacunados.

Covid: 7 mue… https://t.co/4m7RUpmzLR"
2021-04-08 12:57:04,RosaMartinal,327874493,Madrid,1380142649533992960,0,0,[],"No sé cómo me siento ahora mismo: si decepcionada, desesperanzada, cabreada...
Camino de la cuarta ola y se decide… https://t.co/0eHKFAKtcu"
