0,1,2,3,4,5,6,7,8
2021-04-09 13:36:35,segoviaudaz,68437824,Segovia,1380514985403682826,0,0,[],"🔴Atentos los nacidos entre 1947 y 1958🔴

https://t.co/FVYJxKn4Vw"
2021-04-09 13:36:35,zdcjorge,276260035,Madrid,1380514985005047808,0,0,[],"Os queda claro @CarolinaDarias @sanidadgob @sanchezcastejon??
Dejad de poner complicaciones, a la de por si complic… https://t.co/k1nzjKWiho"
2021-04-09 13:36:30,josevelardo85,508220957,LEGANES,1380514961642950657,0,0,[],"@DioniCano3 @GuapodeMente @IdiazAyuso Pues en semana santa como bien dices, estaba el zendal y el Metropolitano con… https://t.co/0P9ywBUna4"
2021-04-09 13:36:01,jmdelalamo,161082845,Madrid,1380514840872169472,0,0,[],@Kannia8 Ese cálculo sería válido si la vacuna de Pfizer en efecto no tiene ese tipo de efectos secundarios y si hu… https://t.co/QAA0DRbzFj
2021-04-09 13:35:57,AraReina,97280427,"Extremadura, España",1380514825655173122,0,0,[],"@jvergelesb A mí no me vale un 70%. Ya que me han puesto una vacuna, quiero la máxima protección posible. ¿Cómo lo… https://t.co/5ISyRMUa12"
2021-04-09 13:35:44,CSurNoticias,36043335,"Andalucía, España",1380514769325715456,3,1,[],"España, uno de los países de Europa con mayor porcentaje de vacunación

🌐 https://t.co/9ZTJJ1la3N https://t.co/DRHWXYFNh9"
2021-04-09 13:35:39,lasprovincias,17618159,"Valencia, Spain",1380514749725696004,0,0,[],Se trata de tres episodios en Estados Unidos y uno durante los ensayos clínicos de esta vacuna que empezará a inocu… https://t.co/pErRghPuAq
2021-04-09 13:35:18,adgardi,271841453,"Valencia, España",1380514659992801290,0,0,[],Se complica y se retrasa la vacunación https://t.co/LpDGPYYUoA
2021-04-09 13:35:16,hugocastierra,810304780505673728,"Comunidad de Madrid, España",1380514654062051334,0,0,[],"@elmundoes Vaya cara que se les habrá quedado a los que rechazaron la vacuna de Astrazeneca ayer en Madrid, les van… https://t.co/wH7PgCLQ0k"
2021-04-09 13:35:10,ralbarn,1270665220223119362,Madrid,1380514625771409417,0,0,[],"@KOPURISTA Sí, parece evidente que tiene mucho que ver con las dudas que están poniendo los medios con la vacuna 😞😞😞😞"
2021-04-09 13:35:02,Estefipeke,248873857,Sevilla,1380514593567543306,2,0,[],"Lamentable lo que están haciendo los medios de comunicación durante esta campaña de vacunación masiva, no ha llegad… https://t.co/MnTnAuuc3F"
2021-04-09 13:35:00,BacoDante1978,133897074,Provincia de Madrid,1380514583677390851,4,0,[],"@marcearg10 @carmenporter_ Los síntomas de la vacunación se ven a partir del 4°día, cuando afecta al sistema inmuni… https://t.co/RQXBXz7SA0"
2021-04-09 13:34:56,franjv86,1074307054171512833,"Talavera de la Reina, España",1380514566749179904,2,0,[],@Joansinmiedo lo mismo es que ninguna comunidad autonóma concentra 6 millones de habitantes en 2 puntos de vacunación.
2021-04-09 13:34:49,PsicoHacking,843533107,"Sevilla, España",1380514540140498944,100,26,[],"Lo de la vacuna de Astrazeneca es el mayor fracaso en comunicación estratégica de la historia reciente, de un impac… https://t.co/DyfCq9tiU8"
2021-04-09 13:34:47,AngieStarman,768376478,Sevilla,1380514529176649732,5,0,[],Su puta madre me ha hecho más reacción la vacuna de la alergia de este mes que la del covid
2021-04-09 13:34:31,ErnestoSigano,387424901,"Abadiño, España",1380514462277455874,2,5,[],"Vaya por dios esta tb???
🤨🤨🤨🤨🤨
Venga don @isaacj que nos pongan una dosis de cada una y nos volvemos inmortales 
 https://t.co/Oz4jqqh4BR"
2021-04-09 13:34:29,gilbellosta,63732672,Madrid,1380514453389770764,0,0,[],"@Picanumeros Pero es que hay teoría (y ""jurisprudencia"") sobre cómo comunicar riesgos pequeños. Se puede decir (si… https://t.co/lTN7gWq1bv"
2021-04-09 13:33:56,FLV56,822795334514606081,,1380514315787251715,0,0,[],"Ayuso negociaba con un comisionista la compra de la vacuna rusa. Desleal con los madrileños, con España y con la Un… https://t.co/MvnGu9wWe9"
2021-04-09 13:33:44,rollandrockss,1037737991194767361,"Badajoz, España",1380514266550300672,1,0,[],"@araelygar @CafedeMadrid @A3Noticias La vacuna no evita el contagio, minimiza los síntomas"
2021-04-09 13:33:28,BacoDante1978,133897074,Provincia de Madrid,1380514201412714498,4,0,[],"@concien91730523 @carmenporter_ Tonterías dices. El problema es a nivel global, qué pinta Iglesias? Ni que la vacun… https://t.co/hthUk79YrB"
2021-04-09 13:33:27,Teleganes,546902102,"Leganés, España",1380514193837846532,2,1,[],Vacunación en Leganés contra el Covid https://t.co/Bz3XaT5vku
2021-04-09 13:33:23,AnaVazquez_7,107511085,Oviedo,1380514176381161472,1,0,[],"Y de esos que la rechazaron, cuantos fue por la imposibilidad de ir a los puntos de vacunación masiva??? https://t.co/GY3Nbbtuzi"
2021-04-09 13:32:59,navarra_com,2941520332,Pamplona,1380514075893972994,0,0,[],Radiografía de la Sputnik: la verdad tras la vacuna estrella de Putin que tanteó comprar Ayuso https://t.co/KyoDOYYRvn
2021-04-09 13:32:35,AlbaTerleira1,2167003096,"Madrid, Comunidad de Madrid",1380513974987407360,13,0,[],"@araelygar @CafedeMadrid @A3Noticias Sabemos que la vacuna no evita el contagio, ¿verdad? Que hay mucha desinformac… https://t.co/sgG2UKoNxC"
2021-04-09 13:32:30,Joansinmiedo,15572962,"Madrid, Comunidad de Madrid",1380513954200453120,3,3,[],Si ninguna otra de las 16 comunidades autónomas reporta caídas similares en la aceptación de citas para la vacunaci… https://t.co/xWterjRKvP
2021-04-09 13:32:25,23javito_,454791354,"Torrelavega, España",1380513935003115526,0,0,[],"Vamos, que van a arriesgarse a generar desconfianza y escepticismo hacia una vacuna en la población por CUATRO puto… https://t.co/tyhfZwA6yM"
2021-04-09 13:32:23,turkuglu,147922906,,1380513927520526336,0,0,[],"@IdiazAyuso @RealYeyYey Jajajajajajaj La que está liando Sánchez, el dominador del mundo...la que están liando todo… https://t.co/0MHjvh1B2s"
2021-04-09 13:32:10,Gacetinmadrid,711593651546226688,"Comunidad de Madrid, España",1380513873153961985,1,0,"[{'text': 'Madrid', 'indices': [74, 81]}, {'text': 'Sanidad', 'indices': [82, 90]}, {'text': 'VacunaciónMadrid', 'indices': [91, 108]}]","Se desploma la vacunación en Madrid por la incertidumbre con AstraZeneca

#Madrid #Sanidad #VacunaciónMadrid… https://t.co/8hzg2Csium"
2021-04-09 13:31:47,AnadlsMiguel7,53474862,"Zaragoza, Spain",1380513777712558081,1,0,[],"Eso sí, me parece bastante gracioso que ahora los medios de comunicación quieran limpiar la cara a la vacuna de AZ… https://t.co/0gVKmNVhSp"
2021-04-09 13:31:42,Vicenteluisper4,958254119063642112,,1380513753092001796,19,11,[],"Alemania al igual que España está buscando vacunas fuera d la UE.
Recurrir a la Rusa.??
Que pena que en vez de darl… https://t.co/psIaVHmy1U"
2021-04-09 13:31:40,_manuelangelrod,306743939,Sevilla,1380513747828150276,0,0,[],"@ManuelMoguer Y si es “no probado”, ¿por que dar tanta difusión a algo “no probado”?  Al final en vez de una vacuna… https://t.co/TZYzZpwaAa"
2021-04-09 13:31:35,JoseEladioMoren,700770794,"Sevilla, España",1380513727091503107,0,0,[],"@quiquepeinado Conozco a unas 10 personas a las que lw han puesto esta vacuna, y todos han tenido fiebre, dolor de… https://t.co/v3lmrthkmc"
2021-04-09 13:31:27,BacoDante1978,133897074,Provincia de Madrid,1380513692819845120,8,0,[],@carmenporter_ Sólo tengo dos dudas. Es AZ la única con problemas o es común a todas las vacunas y sólo se expone m… https://t.co/kUA9HLZMsW
2021-04-09 13:31:16,elenahdez,42607533,"Madrid, Comunidad de Madrid",1380513645243854852,0,0,[],"Pero esto qué es? Por favor, os acordáis de cuando no había vacuna? Os acordáis? https://t.co/L5OKDDy4Bh"
2021-04-09 13:30:50,alvaromaseda,121207479,Madrid/spain,1380513538150653953,0,0,"[{'text': 'AstraZeneca', 'indices': [56, 68]}]",Llevan semanas metiendo miedo al personal con la vacuna #AstraZeneca y ahora les sorprende que la gente no vaya a v… https://t.co/QHvYmOUwoC
2021-04-09 13:30:50,jlemonge29,745298640382603264,"Zaragoza, España",1380513534916825090,0,0,[],"@JessYaoi @delfinocrc Yo entiendo perfectamente, lo que pasa es que aquí en españa o europea no se está vacunando p… https://t.co/YZ0VGVBIxR"
2021-04-09 13:30:40,plr131313,3064824628,"Madrid, Comunidad de Madrid",1380513495922409479,0,0,[],"@IdiazAyuso Con 62,  no me vacuno con AZ. No no me niego a la vacuna pero no con esta incertidumbre. En febrero has… https://t.co/Tq0FXDlfCe"
2021-04-09 13:30:23,lugonlo,78850645,Madrid,1380513422249447439,2,0,[],"Bhutan vacuna a casi todos sus adultos en una semana, con esas pedazo de cuestas y un GDP per capita de 3.300$ (la… https://t.co/jiYJ8PLeSE"
2021-04-09 13:30:14,KikeLahera,509210567,Madrid,1380513386321043462,1,0,[],"@A3Noticias @laSextaTV @DebatAlRojoVivo @EspejoPublico @sanidadgob @MADRID 
Expongo caso:
- Soy el último docente p… https://t.co/XhZREYvPfr"
2021-04-09 13:30:05,noticiascyl,226909192,Castilla y León,1380513348362637315,4,1,[],"💉👇❗MAÑUECO CULPA A SÁNCHEZ DE CREAR ""MIEDO Y CONFUSIÓN"" CON LA VACUNACIÓN❗ https://t.co/i8zzwkBuoN"
2021-04-09 13:30:05,Albardadigital,236516318,Oviedo,1380513347188232200,0,0,[],"@GLlamazares Te digo cómo Jesús a Dios.
¡Padre mío porqué me has abandonado!
.
Y por lo que respecta a la vacuna .… https://t.co/15XRySVOmB"
2021-04-09 13:30:02,COPEJaen,196486847,Jaén,1380513335439892481,0,0,[],Luis del Val: “Más vale no preguntar por qué la vacuna es inocua en los de 65 años y peligrosa en los de 64” https://t.co/8061IsYxZY
2021-04-09 13:30:01,abcdesevilla,42590652,Sevilla,1380513330901704706,3,3,"[{'text': 'AstraZeneca', 'indices': [23, 35]}]",[Vacuna💉] La vacuna de #AstraZeneca se amplía a las personas de 66 a 69 años tras un acuerdo con Sanidad.… https://t.co/6Tu5FaXXVH
2021-04-09 13:29:57,merleta_bib,1497638804,València,1380513314854346754,7,0,[],"@Midietacojea Soy obesa, con problemas respiratorios, historial de neumonias y bronquitis repetitivas. Menor de 50.… https://t.co/AKGeatauvd"
2021-04-09 13:29:17,MiBanderaMiRey,253085384,Madrid,1380513146364956672,4,0,[],El chiste del día de la pistolera @Monica_Garcia_G El 4M será la vacuna contra el mal endémico del social giliproge… https://t.co/ZTZq4gInHK
2021-04-09 13:29:03,ulises_sevilla,2491811966,Sevilla,1380513087602753537,0,1,[],"La vacuna de Janssen, la AstraZeneca, la Sputnik V y hasta una simple aspirina, cualquier medicamento administrado… https://t.co/gv3TnybiYc"
2021-04-09 13:29:00,ppexposito,1165895335,"Sevilla, España",1380513075174969348,1,0,[],@CarmenMartin_ Los ensayos con la vacuna de AstraZeneca se hicieron en personas de hasta 55 años. ¿Qué evidencia de… https://t.co/gDTUutQ1Om
2021-04-09 13:28:48,nataliasara2,121487735,Madrid - Pamplona,1380513024335810565,0,0,"[{'text': 'coronavirus', 'indices': [24, 36]}, {'text': 'AstraZeneca', 'indices': [83, 95]}]","La cifra de muertos por #coronavirus, mil veces mayor que la de trombos por vacuna #AstraZeneca, SI es responsabili… https://t.co/8NZC8JgNDx"
2021-04-09 13:28:45,fenaer2,954284301566316544,"Madrid, España",1380513013724221443,9,4,"[{'text': 'VacunaCOVID19', 'indices': [6, 20]}]",📌 Las #VacunaCOVID19 autorizadas son seguras y eficaces y deben ser prioritarias para pacientes con enfermedades re… https://t.co/TbgkJN1Ifm
2021-04-09 13:28:42,ALB_LOU,264111059,MADRID,1380513001581740037,0,0,[],"La vacunación se desploma en Madrid por miedo a AstraZeneca: sólo acuden 10.800 de los 29.000 citados

Relación cau… https://t.co/nexMBETJbA"
2021-04-09 13:28:22,Chusbrave,407349396,Madrid,1380512916999438337,1,0,[],@claudette_87 👇🏻👇🏻 Están obstinados por cumplir la agenda. Como obedecen todos los políticos al deseo de vacunacion… https://t.co/lmqMidIBvD
2021-04-09 13:28:18,DavidR7efese,1066782547668021248,"Cartagena, España",1380512900192813057,0,0,[],@MariaBarquero97 Que sepas que te has puesto la mejor vacuna que hay actualmente. Le han metido mierda a porque sab… https://t.co/12xyOhIiFX
2021-04-09 13:28:11,jponos,253207269,,1380512868752310283,0,0,"[{'text': '4M', 'indices': [111, 114]}]",Lo dice la persona que prefiere la vacuna rusa antes que las aprobadas por la UE. Vergüenza de @populares y el #4M… https://t.co/qd8bTEj0oF
2021-04-09 13:27:33,hugocastierra,810304780505673728,"Comunidad de Madrid, España",1380512711671484420,1,0,[],@elmundoes La vacuna de Johnson solo tiene una efectividad del 60 % frente a la de Astrazeneca del 72 %. Yo firmo a… https://t.co/FbZrnHLHuT
2021-04-09 13:27:28,gonzadvalle,415347613,Alcalá de Henares,1380512687784927237,0,0,[],"Consecuencia de los cambios de criterio, la vacunación se desploma en Madrid por miedo a AstraZeneca: sólo acuden 1… https://t.co/HDou03U3Qm"
2021-04-09 13:27:18,esRadio_CyL,1269061038,Castilla y León,1380512648119345159,0,0,"[{'text': 'esRadioCyL', 'indices': [44, 55]}]","Vuelve a oír el informativo de las 13.45 en #esRadioCyL🎙️

🔹 @alferma1 y @IdiazAyuso han criticado a… https://t.co/UY0bgyXzbs"
2021-04-09 13:27:08,cambisammet,243232851,"Madrid, Spain",1380512605672980481,0,0,[],@paconadal Me apunto a eso Paco. Vacuna y a viajar!!
2021-04-09 13:26:44,grinwall31,2755121436,"Comunidad de Madrid, España",1380512503323574276,0,0,[],@IdiazAyuso Al final todo esto va a terminar como la serie @LaVallaTV  los infectados por un lado y los sanos por o… https://t.co/qyRNsQg1X2
2021-04-09 13:26:19,OpagacJulio,735833056871862272,"Madrid, España",1380512400865173508,4,1,[],Seychelles pone en marcha vacunación para todos los trabajadores del mar https://t.co/meQXitIAtK vía @Europa Azul
2021-04-09 13:26:16,FranGarciadbc,824219980426313730,"Alicante, España",1380512386235392008,0,0,[],Aquí los que creáis que antes de Mayo se habrá reanudado la vacunación con AstraZeneca para todas las edades 👇🏻
2021-04-09 13:25:58,josal_garcia,507950542,"Mieres, Asturias, España",1380512313619456001,0,0,[],"@javier85357395 @LRsecreta El problema aquí, es que todas estas vacunas para el covid, todas ocasionan trombos, tod… https://t.co/Jbnn2IFtfo"
2021-04-09 13:25:53,javiRpalacios,270990253,Alcalá de Henares,1380512292299739136,69,46,[],Aquí os dejo la razones para exigir que el Hospital Príncipe de Asturias sea un espacio para la vacunación de la… https://t.co/E7K7OYLbXb
2021-04-09 13:25:50,PSPVPSOEXILXES,3029902390,XILXES,1380512277338669059,1,1,[],El presidente del Gobierno anuncia que el ritmo de la vacunación se acelerará desde este mes de abril y pide “sumar… https://t.co/iXlIoV669F
2021-04-09 13:25:48,elcomerciodigit,14225088,Asturias - España,1380512269386276867,1,4,[],Se trata de tres episodios en Estados Unidos y uno durante los ensayos clínicos de esta vacuna que empezará a inocu… https://t.co/lHIBum8SDj
2021-04-09 13:25:45,Doctor_Brainy,1169982641371787264,"Madrid, Spain",1380512257860370436,8,1,[],Ante la desinformación por parte de políticos y periodistas 💯 tífikos (?!) les traigo un RANKING ACTUALIZADO DE VAC… https://t.co/B0hPfp4OMy
2021-04-09 13:25:17,Alva_GG,233258610,"Aragón, Zaragoza",1380512138326913029,1,0,[],@LuchayHonorRMCF @ayec98_2 Eso sí que es buena vacuna.
2021-04-09 13:25:05,ValerianoFern20,1285192315569614848,"Gijón, España",1380512091728142339,1,0,"[{'text': 'VallecasConVox', 'indices': [0, 15]}, {'text': 'TeamVox', 'indices': [22, 30]}, {'text': 'EsHoraDeVox', 'indices': [45, 57]}]",#VallecasConVox       #TeamVox               #EsHoraDeVox                 Las asociaciones de prensa renuncian a pe… https://t.co/QZKwLFwgB4
2021-04-09 13:25:01,alfonso_casi,751842996,"Vitoria-Gasteiz, España",1380512072526614530,0,0,[],Es necesario investigar si una sola dosis de la vacuna de ARNm proporciona una protección eficaz en personas seropositivas.
2021-04-09 13:24:51,alfonso_casi,751842996,"Vitoria-Gasteiz, España",1380512030508060675,1,2,[],"Una sola dosis de vacunas ARNm provoca respuestas inmunitarias las personas seropositivas al SARS-CoV-2, con título… https://t.co/94uQHETCui"
2021-04-09 13:24:32,leonoticias_,38291639,"León, España",1380511949285425161,0,0,[],SOCIEDAD | Se trata de tres episodios en Estados Unidos y uno durante los ensayos clínicos de esta vacuna que empez… https://t.co/TanGuwatjt
2021-04-09 13:24:29,Nuriapifer,125081335,"Comunidad de Madrid, España",1380511939038699527,1,0,[],"hola, una preguntita, a los que ya nos han puesto la primera dosis de AstraZeneca??? Nos damos por vacunados? Nos v… https://t.co/wO4g8reeuv"
2021-04-09 13:24:27,SArtvALDIA,59403176,"Salamanca, España",1380511931505729538,0,0,[],"🗣️ @alferma1  culpa a Sánchez de crear ""miedo y confusión"" con la vacunación https://t.co/fmIYPuVaUO"
2021-04-09 13:24:26,diariosevilla,34238668,"Sevilla, Spain",1380511926690713601,15,10,[],💉❗Posible riesgo de tromboembolismos también con la vacuna de Janssen https://t.co/VBXcKrEmEf
2021-04-09 13:24:06,ropadeletras,477962256,Madrid,1380511843630903300,0,0,[],"Con todo el respeto a ella que tampoco es la responsable pero, por qué a la Reina Sofía se la vacuna en su centro d… https://t.co/AAEeaOHzkp"
2021-04-09 13:23:43,sietediasalhama,913367954359820288,"Alhama de Murcia, España",1380511745479958529,0,0,[],"Manifiesta su preocupación porque el municipio se está quedando ""rezagado"" respecto de otros, como ya ocurrió, recu… https://t.co/kxjWfLrmsA"
2021-04-09 13:23:43,sietediasalhama,913367954359820288,"Alhama de Murcia, España",1380511744209125377,0,0,[],"La concejala de Salud, Rosa Sánchez, explica que la vacunación en el municipio no está avanzando para mayores de 80… https://t.co/hAs0MsHdFf"
2021-04-09 13:23:32,MelendezRonda,1043485057359519744,"Comunidad de Madrid, España",1380511698310807552,0,1,[],Europa estudia casos de trombosis en vacunados contra el Covid con Janssen https://t.co/i73QTlBTGK vía @redaccionmedica
2021-04-09 13:23:32,canogimenez,420552296,"Elche, España",1380511698252148742,1,0,[],"@GeorgeKplan 😅
Si conoces la referencia, es que ya casi estas en la franja de edad para ponerte la vacuna 😂"
2021-04-09 13:23:26,JPlanas,12829832,"Tarragona, Catalunya",1380511675158294528,2,1,"[{'text': 'Observando', 'indices': [0, 11]}]","#Observando: ""Ojalá se revisase la homeopatía la mitad que la vacuna de Astrazeneca"" https://t.co/nagqogYYkP"
2021-04-09 13:23:26,serafin_fraile,1335236098780442626,"Santa Marta de Tormes, España",1380511673467944961,0,0,[],"Coronavirus España hoy, noticias de última hora  | La Agencia Europea del Medicamento investiga el riesgo de trombo… https://t.co/kI0bSQUB6b"
2021-04-09 13:23:24,radio5_rne,57779483,"Madrid, España",1380511664454393859,0,0,[],"💉¿Se puede elegir la vacuna en Europa?

▪️ En la UE esto es algo que no contempla prácticamente ningún Estado. Fran… https://t.co/5ZBVzYPKJh"
2021-04-09 13:22:53,elespinar_org,317812404,El Espinar,1380511536897273875,1,0,[],"Programación de la vacunación de la semana del 12 al 16 de abril.

La Junta extiende la vacunación en Segovia a los… https://t.co/HFpqcJ8JmE"
2021-04-09 13:22:33,SpainToMinute,2960399925,Madrid,1380511450389643273,0,0,[],"Sánchez reafirma que ""ningún país va a salir adelante actuando solo"", tras el interés de Alemania por la vacuna rus… https://t.co/iKFcYPxdDQ"
2021-04-09 13:22:12,CarlosGC4,409379424,Madrid,1380511364372963328,6,0,[],"@elmundoes Si esta señora es la vacuna, me hago negacionista"
2021-04-09 13:22:02,lluismengu,2718013126,"Comunidad Valenciana, España",1380511323474300928,3,2,[],"Pretends to be shocked. 
Normal, con todo el alarmismo que hacéis los medios de comunicación ya me contaréis. 
Lueg… https://t.co/aNC09zmNog"
2021-04-09 13:21:58,puntocomunica2,444456735,"Valencia, España",1380511307229753357,0,0,[],El teléfono gratuito 900 300 555 habilitado por Sanidad se refuerza para optimizar la resolución de dudas sobre vac… https://t.co/LxAPO9BYE8
2021-04-09 13:21:57,Nuevas_Getafe,462448228,"Getafe, España",1380511299461918721,0,0,[],La inutilidad del Gobierno en relación a la vacuna de AstraZeneca provoca miedo e incertidumbre entre la gente que… https://t.co/2HB2BkOvM8
2021-04-09 13:21:49,elrincondemadri,811964227,Madrigal de las Altas Torres,1380511269166403587,1,0,[],Vacunación en Arévalo https://t.co/5TPsicZz4H
2021-04-09 13:21:37,PyotrKBezukhov,1053625850996969472,Albacete,1380511216863485952,0,0,[],@martinvars Esto parece que comienza a aliviarse. Y no solo por la vacuna. Parece relacionado también con la propia… https://t.co/PeHnIZVFtU
2021-04-09 13:21:36,tiuna88,209590655,"Madrid, España",1380511214246187011,1,0,[],@elmundoes Pues no necesito vuestra vacuna.  Gracias
2021-04-09 13:21:29,CirezRibera,1354028729035534337,"Comunidad Valenciana, España",1380511182063333379,2,0,[],"@elmundoes 😂😂😂😂😂😂😂😂😂😂😂😂😂😂😂😂😂😂😂😂😂😂

La vacuna dice 
😂😂😂😂😂😂"
2021-04-09 13:21:17,RafaelTimermans,28206117,"Pozuelo de Alarcón, España",1380511132235018246,0,1,[],"@1908anguila 900 102 112

Opción 1. Citas para vacunación."
2021-04-09 13:20:42,adelacastano,255247764,Sevilla,1380510986889797636,92,3,[],"Hace un rato he recibido una magnífica noticia,  me han llamado de mi Centro de Salud "" Fuensanta Pérez Quiros "" de… https://t.co/RpzkTl2w2k"
2021-04-09 13:20:41,marserranog,460363672,Madrid,1380510980548001793,1,0,[],"Sánchez involución 
——
La vacunación se desploma en Madrid por miedo a AstraZeneca: sólo acuden 10.800 de los 29.00… https://t.co/GjAYcSdpfF"
2021-04-09 13:20:24,carola_hermoso,2284764408,Madrid,1380510912621252608,2,0,[],"@AntaEugenia @IdiazAyuso A mi suegra (78) la han llamado hoy (Madrid zona centro- Pfizer) para cubrir una vacante,… https://t.co/xg2Iwpg6Yu"
2021-04-09 13:20:21,NARANCO28,246980075,oviedo,1380510896599011336,2,0,[],"Cuando traigan la vacuna rusa🚀 y digan que no se puede chumar en 40 días, habrá leches para ponerse la de TromboZen… https://t.co/GhPl00fkWP"
2021-04-09 13:20:12,Region_Digital,135915094,"Badajoz, Spain",1380510862360903684,0,0,[],Extremadura completará esta semana la vacunación de sus mayores de 80 años https://t.co/o1sVf2s6Tj
2021-04-09 13:20:11,ElHuffPost,364528766,"Madrid, Spain",1380510855746441218,15,12,[],"La EMA investiga la aparición de trombos en cuatro pacientes tras vacunarse con Janssen
https://t.co/juCJThPbPs"
2021-04-09 13:20:09,LughCelta10,1324425146443190275,Madrid,1380510848125435904,0,0,[],"@ivannavarromart @IdiazAyuso En otros países han decidido parar completamente la vacunación con AstraZeneca, a lo q… https://t.co/yT8JJZJhXc"
2021-04-09 13:19:58,UribeX,92249250,León (España),1380510801031794688,0,0,[],"@ComdBanana @jmdelalamo No mato a nadie. Punto.

Y morirían muchos más más si me negara a que se vacunara.

Ningún… https://t.co/jfNJqQjvZV"
2021-04-09 13:19:54,NextColombo,4915471623,Madrid Centro ,1380510785013755917,0,0,[],@telemadrid @ZapateroAntonio @BuenosDiasTM Las negociaciones de la Comunidad de Madrid con el Gobierno Ruso para ad… https://t.co/RX5TqsLgWA
2021-04-09 13:19:48,nachosomalo,47283835,Madrid,1380510758165999619,0,0,[],Ahora vamos a cargarnos otra vacuna... https://t.co/FXNdOLw7gu
2021-04-09 13:19:47,PabloAlonsoRui2,774713877401636864,"Leganés, España",1380510757843001347,3,0,[],"@SmokingBarrel5 Da igual la igual la ""vacuna"", da igual la posología, da igual que tengas o no anticuerpos, da igua… https://t.co/fWY5TTfWND"
2021-04-09 13:19:24,lashIndustries,461364162,"Tudela, España",1380510660920897544,9,1,[],Te imaginas que no tener que esperar 4 horas en una fila al aire libre para entrar en los dos únicos centros de vac… https://t.co/2xq54ccCBs
2021-04-09 13:19:18,diecicatorce_,1259760727390408705,"Madrid, España",1380510633574203395,0,0,[],"A la unión europea no quiere la Sputnik porque es Rusa Putin comunismo mimimi. Es una vacuna, funciona y es segura,… https://t.co/xAqHoLg9rh"
2021-04-09 13:19:17,Bringbacking,1325536574218629122,"Madrid, Comunidad de Madrid",1380510629937696770,0,0,[],"@jorge_salazar64 @velardedaoiz2 Dígamelo a la ciencia, q no ha desarrollado ninguna vacuna eficaz contra el VIH, en… https://t.co/kqp1XMUwLt"
2021-04-09 13:19:13,la8avila,2370252986,Ávila,1380510612791394314,0,0,"[{'text': 'AstraZeneca', 'indices': [29, 41]}, {'text': 'Ávila', 'indices': [45, 51]}]",Se reanuda la vacunación con #AstraZeneca en #Ávila con los nacidos en 1956 y 1957 de la capital y las ZBS de Ávila… https://t.co/BelWTS7Smq
2021-04-09 13:19:12,jatirado_oc,1034559695808356352,"Madrid, Comunidad de Madrid",1380510608727056386,2,3,[],Analizan casos de coágulos sanguíneos potencialmente vinculados con vacuna de Johnson &amp; Johnson… https://t.co/RLrOtYVfnB
2021-04-09 13:19:09,jatirado_oc,1034559695808356352,"Madrid, Comunidad de Madrid",1380510596609699846,0,2,"[{'text': 'Sociedad', 'indices': [0, 9]}]",#Sociedad CORONAVIRUS VACUNAS - La vacuna rusa Sputnik V abre un debate en la política de compras de la UE… https://t.co/NKsUWxc0t2
2021-04-09 13:19:05,JesusMartin_95,369689188,Ávila,1380510580147163137,7,1,[],"Los problemas que llevamos teniendo durante más de un año derivados de la pandemia, vacunación... no serían tan gra… https://t.co/ERHiU7j6Rk"
2021-04-09 13:19:04,noticiasdburgos,2502033920,"Burgos, España",1380510574539333635,0,1,"[{'text': 'vacunación', 'indices': [5, 16]}, {'text': 'AstraZeneca', 'indices': [21, 33]}]","💉 La #vacunación con #AstraZeneca continúa en Burgos, Miranda de Ebro, Aranda de Duero y Villarcayo
https://t.co/M08O0TMpLs"
2021-04-09 13:19:02,RobertoRHAV,486961410,"Madrid, España",1380510568923201536,1,0,[],Me da rabia que haya tanto rechazo a la vacuna de AstraZeneca por culpa de políticos y medios de comunicación 🤬
2021-04-09 13:19:02,MARIA_LAFFITTE,208486458,SEVILLA,1380510566649843716,1,0,"[{'text': 'AstraZeneca', 'indices': [100, 112]}]",Parece ser una buena decisión el consentimiento firmado @JuanMa_Moreno @JuanMarin_Cs para la vacuna #AstraZeneca y… https://t.co/qzL7yKB21W
