0,1,2,3,4,5,6,7,8
2021-04-09 19:32:16,stromboli72,365757441,VLC,1380604494535393280,1,0,[],"@josueguren Creo que esto ocurre, poco más o menos, en todas partes. Lo cierto es que Londres ha actuado con mano d… https://t.co/6Ic0xt3Hdm"
2021-04-09 19:32:15,_sr_lobo,59733853,Oviedo - Asturias - Spain,1380604488294277120,18,0,[],"Mi padre recibió la primera dosis d la vacuna el lunes, y hoy han llamado a mi madre para recibir la primera dosis el próximo viernes 🕺🕺🕺"
2021-04-09 19:32:00,ElHuffPost,364528766,"Madrid, Spain",1380604426247757824,16,9,[],"El presidente del Consejo General del Poder Judicial, Carlos Lesmes, sobre la vacunación en el Zendal: “Podía organ… https://t.co/muLNT55ujM"
2021-04-09 19:31:38,rosarobco,255989017,Madrid,1380604333994168324,829,498,[],"No soy @sanchezcastejon soy una madrileña ma y corroboro que Madrid miente en los datos que da, estamos en riesgo e… https://t.co/r7lKr3cLXQ"
2021-04-09 19:31:09,JJOLIVAN,244485430,Madrid,1380604213240156167,0,0,[],La vacunación con Sputnik V no despega en Rusia mientras el Kremlin amplía sus esfuerzos por promocionarla fuera… https://t.co/Pl3VhEdmSN
2021-04-09 19:30:45,Juanbilbo7,1880877164,Bilbao,1380604111629000706,0,0,[],Se sabe la causa de los trombos de la vacuna de AstraZeneca https://t.co/KpPggZJJGv
2021-04-09 19:30:21,LesBauxdeProven,1539595405,Madrid,1380604010261061634,2,1,[],@matsmadrid @SATSE_Madrid @amytsmedicos @madrid_ame @HZendal Cuando la vacunación se convierte en un show; no impor… https://t.co/NlhTiXtYGY
2021-04-09 19:30:12,carlititos25,3368919531,Salamanca,1380603972768129027,30,5,[],"Si me dicen que mañana me pueden vacunar, pero la vacuna es de AstraZeneca, da por hecho que llego incluso antes de… https://t.co/BjwcjBU0q2"
2021-04-09 19:30:09,Mara_villa1981,906888225456889856,"Región de Murcia, España",1380603962701778944,0,0,[],@PPRMurcia @quinosegado @miriamguard @Meryposas12 @PPAlhama @gppmur Delincuentes y psicópatas que os saltais el pro… https://t.co/OX6iXLXefg
2021-04-09 19:30:07,PedroMLozano,515724889,"Águilas, España",1380603953864450055,9,0,[],"Fernando, quiero mi vacuna. Primer aviso. https://t.co/Nnh2N96bQX"
2021-04-09 19:30:02,laverdad_es,44898619,Región de Murcia,1380603930426638337,0,0,[],Unas 2.500 personas de entre 75 y 79 años estaban citadas hoy en San Javier https://t.co/uQ7Ho5am5o
2021-04-09 19:30:01,epmediterraneo,230803697,"Castellón, España",1380603930099519490,4,1,[],CRISIS DEL CORONAVIRUS | Castellón ha administrado más de 120.000 dosis de la vacuna contra la covid https://t.co/Ykwzdx6Twt
2021-04-09 19:30:01,EPExtremadura,194202717,"Extremadura, España",1380603929000574986,0,0,[],💉La Agencia Europea del Medicamento investiga el riesgo de trombos con la vacuna de Janssen https://t.co/f9O4WyFq1g
2021-04-09 19:30:01,granadahoy,10653662,Granada,1380603928904093707,2,1,[],Posible riesgo de tromboembolismos también con la vacuna de Janssen https://t.co/okAh3t9A9W
2021-04-09 19:29:19,astolph00,2457877797,"País Vasco, España",1380603751522787334,0,0,[],@martinvars El que no acuda a la cita de vacunación y no avise multón (si avisa no)
2021-04-09 19:29:06,viksang,99064908,"Madrid, España",1380603698523553799,0,0,[],Este magnífico artículo de Kiko Llaneras nos da la medida del error mayúsculo que se está cometiendo con el tema de… https://t.co/xsQM4V8VBb
2021-04-09 19:28:54,RugierodiLauria,769635680846811136,"Madrid, Spain",1380603646497468417,1,0,[],"@sanchezcastejon @Defensagob @EjercitoAire Vamos, que te has quedado callado con tus acusaciones sobre Madrid ¿eh m… https://t.co/KwZvsGVKWy"
2021-04-09 19:28:50,clianthaazul,205350648,"Principado de Asturias, España",1380603629317582851,6,0,[],A mi lo de la vacunas 💉 me alegra un montón... y más ahora con lo que está avanzando ya su aplicación. Cualquiera d… https://t.co/bbYgPT8iOt
2021-04-09 19:28:15,PKJNS,296956875,BILBAO,1380603483552890882,0,0,[],Asco tanto politiqueo con la vacunación. Nunca pensé que @IdiazAyuso se iba a declarar independentista. Vamos Isa: In-de-pen-den-tzia!!
2021-04-09 19:27:24,josueguren,69855468,Bilbao,1380603271681806338,1,0,[],@stromboli72 Me considero una persona informada y esos detalles sobre la vacunación de AZ en UK no los conocía. La… https://t.co/Lr7Qg01scu
2021-04-09 19:27:15,exSociata,296721499,"Comunidad Valenciana, España",1380603233668841478,2,0,[],@rojo_roto @IdiazAyuso @PSOE Negociar con Rusia para traer la vacuna Sputnik. Suma y sigue
2021-04-09 19:27:12,PabloAlonsoRui2,774713877401636864,"Leganés, España",1380603217701126145,0,0,[],"@IdiazAyuso ¿Cuál vacuna? Qué más da, no? 
Da igual la vacuna, la cepa, la posología, la presencia de anticuerpos..… https://t.co/pTX1gNbUEP"
2021-04-09 19:27:09,DeMiguelConde,94440356,"Granada, España",1380603208612073475,1,0,"[{'text': 'Andalucía', 'indices': [17, 27]}]","¿Cuánto tardaría #Andalucía en llegar a la inmunidad de rebaño según el ritmo de vacunación actual? 21,  22, 23, 24… https://t.co/wihRTXol8L"
2021-04-09 19:27:09,Volrathth,363382220,"Madrid, Comunidad de Madrid",1380603204862349312,1,0,[],"@Miss_Dot Decían que se calcula que 10.400 vidas se han salvado por las vacunas de AZ. Eso con la letra pequeña.
Oj… https://t.co/jQUZeYTEvk"
2021-04-09 19:26:41,Segura_Ricardo,320715605,Madrid,1380603088764035077,0,0,[],Muchos defendéis la vacuna de Oxford Astrazeneca. Me pregunto si podríais asegurarme que nuestros políticos se van… https://t.co/i7O7FOnMHP
2021-04-09 19:26:33,andres100fire,437535947,Sevilla,1380603056358879237,0,0,[],"Tele 5: La Reina Sofía se vacuna como una ciudadana más.

Yo: ¿Dónde está mi coche oficial, mi escolta y mi chófer?"
2021-04-09 19:26:06,generalmatraca,4107839489,"Sevilla, España",1380602944211521537,0,0,[],"@vox_es El cambio climático es una mentira, la violencia de género es una mentira, la pandemia es una mentira, la v… https://t.co/tjKaov0NNT"
2021-04-09 19:25:55,Hkto_Khan,87485942,Valladolid,1380602897906405384,1,0,[],"No os flipeis, que la Reina Sofía ha ido a vacunarse ella solita sin ni si quiera esperar cola.. Privilegios que no… https://t.co/oJWhvkrWxO"
2021-04-09 19:25:46,marycarmencid,302622806,"Madrid, España",1380602860254154755,0,0,[],"@HerreraenCOPE Vamos, cualquier vacuna y medicamento tiene efectos secundarios,"
2021-04-09 19:25:40,Asoalblancoz,1319708593852190720,"Región de Murcia, España ",1380602834861838342,0,0,[],"""Expertos en salud alertan sobre el riesgo de rechazo a la vacuna AstraZeneca y explican efectos de fármacos""  https://t.co/jbPbQ9bfbm"
2021-04-09 19:25:36,danivaldivia15,454351037,"Dos Hermanas, Sevilla",1380602815010246663,0,0,[],"Fantástico resumen de @diariosevilla sobre la vacunación en Andalucía.

El 6% de los andaluces ya están inmunizados… https://t.co/DzfFwSbHDx"
2021-04-09 19:25:29,wethetraders,486071390,Bilbao,1380602786199527427,0,0,[],"Sus vecinos ya la están recibiendo. Mi suegro, también. Los medios de comunicación se hacen eco del programa de vac… https://t.co/RNfrCNhTpO"
2021-04-09 19:25:27,El_mono_bonobo,359585673,"Burgos, España",1380602778964332547,0,0,[],"@Brioja_FN La cuestión no es esa. Debido a la publicidad que le han hecho a esa vacuna, si te dan a elegir entre la… https://t.co/OtNHYiqOMO"
2021-04-09 19:25:23,forox01,551558673,"Valladolid, España",1380602761109241856,0,0,[],"Desde luego la gestión de la epidemia, vacunación, crisis económica y social en Europa está siendo de escondernos l… https://t.co/uuEZZrwATC"
2021-04-09 19:25:17,mariopereirag,1368675565398593538,Madrid,1380602736941600769,0,0,[],@carinho9 @ldpsincomplejos sólo comprometen a los gobiernos (amén de generar sobre los gobernantes una posición de… https://t.co/Jnau7pBo9W
2021-04-09 19:25:10,i_zorrilla,462422552,Vitoria-Gasteiz,1380602708407767045,0,0,[],Solo un 30%....creo q la campaña de vacunacion corre riesgo https://t.co/PT7rVl0k3C
2021-04-09 19:25:03,el_pais,7996082,Madrid,1380602679739744264,106,19,[],"“No me hace gracia esta vacuna por todo lo que he escuchado”, dice Rosa. Pero añade: ""No vacunarte es irresponsable… https://t.co/xQ0Y508gED"
2021-04-09 19:24:42,Chufergranota,409333661,Alboraya ,1380602588534616065,3,0,[],"Que si no quieren la vacuna de AZ, que nos dejen ponermosla a los que queremos y no nos dejan."
2021-04-09 19:24:41,Espinete_Oscuro,876207415,"Murcia, España",1380602584889712647,33,10,[],La mejor vacuna es pegarse un escopetazo.
2021-04-09 19:23:29,NarbartePepi,1374041090840535046,,1380602284275597313,0,0,[],"@beagarram @ccarballo50 Y eso si no se han posicionado , directamente , contra la vacuna, los hay irresponsables, dentro del periodismo"
2021-04-09 19:23:11,Chorrapela,3261094518,"Cantabria, España",1380602206357950473,0,0,"[{'text': 'mascarilla', 'indices': [43, 54]}]","Somos tan valientes en las terrazas sin la #mascarilla (solo se debe retirar para comer o beber, no en las 3 horas… https://t.co/3VW4mPA8dm"
2021-04-09 19:22:57,tecn_preocupado,306946423,"Valencia, España",1380602147671277578,59,34,"[{'text': 'MiVidaMiOxigeno', 'indices': [46, 62]}, {'text': 'SinBozalMásNatural', 'indices': [64, 83]}]","Voy a meterme la primera dosis de la vacuna.

#MiVidaMiOxigeno 
#SinBozalMásNatural https://t.co/7adD0e0dFO"
2021-04-09 19:22:46,wethetraders,486071390,Bilbao,1380602105338155008,0,1,[],"Mi madre, 83 años, recibió hace un mes una llamada para preguntar si deseaba vacunarse.
La respuesta fue afirmativa… https://t.co/qbuDgE9pDl"
2021-04-09 19:22:38,CharlesRamses6,1326938256622186496,"Madrid, Comunidad de Madrid",1380602068768022536,0,0,[],"@rbst4 @EnfrmraSaturada Porque señor, vacunamos en la salan de vacunación covid en la planta baja. Los médicos no e… https://t.co/7EvxNejZvB"
2021-04-09 19:22:11,nacho676,1390213880,Madrid,1380601957291802627,0,0,[],"@ChepasR @covid_vacuna @manumarlasca @policia Este es, exactamente, mi punto."
2021-04-09 19:21:57,Barcelo22324375,998559402394341377,Toda España. ,1380601898370265098,0,0,[],@marubimo Incluso @Fabian10_ y más reporteras estaban en las colas de vacunación diciendo a la gente qué en otras c… https://t.co/TkWGpuRXoM
2021-04-09 19:21:50,Bringbacking,1325536574218629122,"Madrid, Comunidad de Madrid",1380601870322925576,0,0,[],"@ya_no_soy @nandogcz @velardedaoiz2 No, no entiendo nada soy un inmunólogo de parque, según un sacamuelas...
Borre… https://t.co/IJiQWIABDt"
2021-04-09 19:21:32,CamisetasRV,1125500430883139584,"Guadalajara, España",1380601794942939140,2,0,[],@B_ducept @Tetesa00554364 @ccarballo50 @nuriarevalo89 Totalment. Conozco el caso. Del cual no se sabe si es relacio… https://t.co/o413xNY4yZ
2021-04-09 19:21:19,mar_gmartinez,382799916,"Valencia, España",1380601738441396224,8,2,[],Tan importante este cálculo de los riesgos y beneficios de la vacuna de AstraZeneca. Vía @el_pais https://t.co/cRdLgqjyh1
2021-04-09 19:21:17,nxchoxrvl__,888718461970591746,"Salamanca, España",1380601732263206920,13,1,[],¿Tienes miedo a un trombo por una vacuna? Pues no te leas un prospecto de una píldora o de un Ibuprofeno pq si no lo flipas xd
2021-04-09 19:21:16,SuperRoStar,502111935,Madrid,1380601724512112651,336,60,[],"Seguimos sin hacer caso a los expertos. 
Suspender la vacunación es dar alas a los negacionistas.

Dónde demonios e… https://t.co/5gBnY5N6Z6"
2021-04-09 19:21:00,publico_es,17676713,"Madrid, Spain",1380601657868877831,18,11,[],"""Están quitando edades, poniendo edades... Ese desconcierto preocupa a la gente"".

Los continuos cambios sobre la v… https://t.co/6p8mZrjuuD"
2021-04-09 19:20:57,EFEnoticias,105082141,Madrid,1380601647013986305,9,4,[],El debate sobre la creación de un documento para identificar a los vacunados contra la covid-19 se ha intensificado… https://t.co/umFrNPdGg3
2021-04-09 19:20:56,ladymiautito,236613949,Madrid - España,1380601642568060936,1,0,[],"@PattsD Enhorabuena. A mi no se ni cuando me vacunan, y a mis suegra de aquí a que la vacunen la estranguló porque… https://t.co/F4RKjCiId9"
2021-04-09 19:20:37,MariodMadrid,1263840269369315330,"Madrid, Comunidad de Madrid",1380601561718648843,1,0,[],"@Treintayalguno @IdiazAyuso ASTRAZENECA NO, POR FAVOR

https://t.co/4FMyuMnpKo"
2021-04-09 19:20:10,gener_p,3247918931,Valencia (España),1380601450519277574,1,0,[],"No es Sánchez ni el Gobierno, ni tampoco los científicos, los que están generando dudas con la vacuna de AstraZenec… https://t.co/CGlnpg92fi"
2021-04-09 19:19:47,AgenciaIcal,704958229,Castilla y León,1380601352661962752,0,0,[],"Un total de 566 sorianos de 1956 y 1957 se vacunan en el Santa Bárbara con AstraZeneca en una tarde

➡️La Delegació… https://t.co/7KGWwci1dE"
2021-04-09 19:19:14,7Josean7,1577384395,"Bilbao, España",1380601214547726341,1,2,[],Breve evaluación de la vacunación contra el coronavirus por países - El Común https://t.co/YhQCrkmgdy
2021-04-09 19:19:09,jluisperez,153851528,"Getafe, España",1380601194641510406,1,0,[],@el_pais @RguezBurgos Pero habría que meter en la ecuación la efectividad de la vacuna no? Que anda por el 65%
2021-04-09 19:18:53,GuardiaJuez,1379866185068597252,Madrid,1380601127675252739,2,1,[],"Admón.Vacuna de AstraZeneca Ministerio Sanidad
Enero: +55 años
Febrero: -55 años
Marzo: 50-65 años
Abril: La retiro… https://t.co/ucP9GSyXoI"
2021-04-09 19:18:52,MiguArroyoPerez,336984318,"Madrid, Comunidad de Madrid",1380601122889535488,0,0,[],"@almudenanegro Bien, pero tendrían que atarme para inocularme una vacuna china o rusa."
2021-04-09 19:18:40,SoniaGoenagai69,277149345,Bilbao,1380601072675328001,1,0,[],"@ccarballo50 Yo no tengo muefo, si me toca Astrazeneca, encantada. Creo que son injustos y rastreros los ataques a esta vacuna."
2021-04-09 19:18:34,ESFERARED,1216177118,"Comunidad de Madrid, España",1380601047815688195,7,0,[],Y saben por que es esto ? No se puede beber en casi 2 meses con esta vacuna .... https://t.co/dftZW89pmg
2021-04-09 19:18:29,eneltejado,269897350,,1380601027297173517,4,1,[],"@aybarrapacheco @abcdesevilla  No soy suficientemente viejo, ni felizmemte joven, ni sector preferente, ni libre de… https://t.co/I8ZoOIHN4y"
2021-04-09 19:18:07,EduSanRe,147223506,"Castilla-La Mancha, España",1380600931969028098,21,1,[],"Sí, soy yo. Estoy publicando los datos de vacunación de mi región a diario en @VacunacionCLM.

Ojalá pronto deje de… https://t.co/NuAy1TOX0N"
2021-04-09 19:18:06,lumipife,235276827,"Logroño, la ciudad que rima.",1380600929502822401,0,0,[],Aquí uno que no tiene miedo de la vacuna 🙋‍♂️
2021-04-09 19:18:04,MJCampilloP,753869042180558848,"Murcia, España",1380600921537851393,10,3,[],"Los vaivenes con la vacuna de Astrazeneca , esta provocando tanta inseguridad y confusión que muchos no quieren pon… https://t.co/bHCVqibSJC"
2021-04-09 19:18:01,Chorrapela,3261094518,"Cantabria, España",1380600908304760835,1,1,"[{'text': 'vacuna', 'indices': [50, 57]}, {'text': 'Pfizer', 'indices': [61, 68]}, {'text': 'Moderna', 'indices': [71, 79]}]",Pues en Francia inyectará la segunda dosis con la #vacuna de #Pfizer o #Moderna a los vacunados con la primera dosi… https://t.co/K5xfwtySMK
2021-04-09 19:17:48,JaimePeris,270585820,"Ontinyent, Valencia",1380600853611040768,3,2,[],Sanidad refuerza el teléfono gratuito 900 300 555 para resolver dudas sobre vacunación contra el coronavirus… https://t.co/V1ZTlCKCG9
2021-04-09 19:17:32,SamKoziner,121512689,Donosti,1380600788175745026,0,0,[],Ya sé que vacuna quiero https://t.co/PeZ47k81qk
2021-04-09 19:17:16,HospInfantaMarg,200622464,Cabra (Córdoba),1380600720114774019,2,0,"[{'text': 'HospitalInfantaMargarita', 'indices': [4, 29]}, {'text': 'vᴀᴄᴜɴᴀcᴏᴠɪᴅ19', 'indices': [60, 74]}]",✅El #HospitalInfantaMargarita ha comenzado hoy a aplicar la #vᴀᴄᴜɴᴀcᴏᴠɪᴅ19 al denominado como ‘grupo 7’ dentro del… https://t.co/gOdRpBzXdP
2021-04-09 19:17:12,mpraena,36652909,"Sevilla, Spain",1380600701550788609,2,0,[],Todos estos factores hacen que cualquier decisión sobre la vacuna Astra-Zeneca sea compleja: la relación riesgo: be… https://t.co/I2MZqMclSI
2021-04-09 19:17:11,mpraena,36652909,"Sevilla, Spain",1380600697754951684,1,0,[],"una reacción de coágulo de sangre, entonces eso podría inclinar una decisión a favor de tomar esa vacuna en lugar d… https://t.co/Y6CmnriwJV"
2021-04-09 19:17:10,mpraena,36652909,"Sevilla, Spain",1380600695968174080,1,0,[],"Tampoco se ilustra el beneficio de no transmitir el virus a otros. Al tomar decisiones, también es importante tener… https://t.co/30zqg0X1hI"
2021-04-09 19:17:09,mpraena,36652909,"Sevilla, Spain",1380600689878040576,1,0,[],"El riesgo de la vacunación ocurre solo en el momento de la vacunación. Esto significa que con el tiempo, los benefi… https://t.co/xuOPJfPp2v"
2021-04-09 19:17:08,mpraena,36652909,"Sevilla, Spain",1380600687889879043,1,0,[],... que podrían estarlo). llevándolo). Las personas con afecciones de salud subyacentes que aumentan el riesgo de u… https://t.co/hKwj0nUSaB
2021-04-09 19:17:07,mpraena,36652909,"Sevilla, Spain",1380600683741732864,1,0,[],En esta figura se presentan los daños y benficios de la vacuna de Astra-Zeneca cuando hay una alta exposición (inci… https://t.co/kEZEVsIBjP
2021-04-09 19:17:06,mpraena,36652909,"Sevilla, Spain",1380600678645633025,0,0,[],En esta figura se ilustran daños y beneficios de la vacuna Astra-Zeneca según edades teniendo en cuenta una una exp… https://t.co/bJMrdR0v2G
2021-04-09 19:17:05,mpraena,36652909,"Sevilla, Spain",1380600673537040384,1,0,[],Elegimos ilustrar el número estimado de hospitalizaciones en UCI evitadas por la vacuna (por franja de edad). Tambi… https://t.co/0OtZPwgAuJ
2021-04-09 19:17:04,mpraena,36652909,"Sevilla, Spain",1380600667706945537,1,0,[],"Beneficios potenciales:
Los beneficios de la vacuna son la protección contra COVID-19 (COVID a corto plazo y 'COVID… https://t.co/F9LGPJkpE3"
2021-04-09 19:17:03,mpraena,36652909,"Sevilla, Spain",1380600664326340611,4,1,[],"Aprovechando el tuit del Dr. Martinón presentamos una noticia tomada del ""Winston Center for Risk and Evidence Comm… https://t.co/reeocyvaJ3"
2021-04-09 19:16:58,IdoiaPalomares,1904385288,"Comunidad Valenciana, España",1380600641878437889,5,1,[],"Pueden dejar de desinformar los medios? O como eso no vende mejor meterle medio a la población?
AZ la vacuna con me… https://t.co/4AJCHQLVeb"
2021-04-09 19:16:07,_justo_gonzalez,70766106,elche,1380600431894794242,30,10,"[{'text': 'AstraZeneca', 'indices': [57, 69]}, {'text': 'EMA', 'indices': [94, 98]}]",@sociabilitis @PorPublica Hoy me han inyectado la vacuna #AstraZeneca Toda mi confianza en la #EMA (Agencia Europea… https://t.co/scjw1c0cFg
2021-04-09 19:16:06,SellersManu,1164265646,"Cáceres, España",1380600424454049793,0,0,"[{'text': 'jansen', 'indices': [86, 93]}]","Si de verdad la nueva vacuna se llama Janssen es imposible que sea mala, no me jodas 
#jansen https://t.co/5ldtupOEwe"
2021-04-09 19:15:32,Xema89,53241010,"Madrid, Comunidad de Madrid",1380600283957497859,0,1,[],A toda esa gente que no se ha presentado a que los vacunen por hacer tiempo para que les pongan otra vacuna les dej… https://t.co/uyOuuFKnHh
2021-04-09 19:15:32,Enri_choquero,534113914,"Andalucía, España",1380600283668041730,3,4,[],Sindicatos de prisiones piden a Sanidad que aclare la vacunación suministrada a 10.000 funcionarios por ahora… https://t.co/fpQb5OrVOl
2021-04-09 19:15:30,IrureMaria,840087338,"Zaragoza, España",1380600273463349252,0,0,[],"Pasaron de Oxford a AstraZeneca. Ahora a Vaxzevria.
Son especialistas en cambiar de imagen. Siguen siendo los mismo… https://t.co/2m7miNDqWn"
2021-04-09 19:15:18,JesusMMachado2,1271494376259190785,,1380600223685304329,0,0,[],"HOY ME HA DOLIDO MÁS LA CABEZA, QUIZÁS DEBIDO A MÍ INCOMPETENCIA. La crisis de AstraZeneca ya se nota en el rechazo… https://t.co/qoI7cmnCz2"
2021-04-09 19:15:13,isabelpinoj15,739550149240840192,"Madrid, España",1380600202244067330,1,0,[],"@ccarballo50 Mis padres: 69 y 66 anyos aún no les han llamado para que se vacunen, me dicen que les da igual una va… https://t.co/qlSpYbolmD"
2021-04-09 19:15:09,Gacetinmadrid,711593651546226688,"Comunidad de Madrid, España",1380600185022263306,2,1,[],"La EMA abre una investigación sobre el posible riesgo de tromboembolismos con Janssen, vacuna de la que España reci… https://t.co/D1xuPFofeT"
2021-04-09 19:15:03,ORMurcia,300407444,Región de Murcia,1380600159810301956,1,0,[],"Unas 800 personas reciben la vacuna contra la Covid-19 en Jumilla
https://t.co/QD8gQXzcTP"
2021-04-09 19:15:01,EPExtremadura,194202717,"Extremadura, España",1380600154902892549,1,0,[],Sánchez no se cierra a la vacuna rusa Sputnik pero siempre en el seno de la UE https://t.co/EgLEjHXV06
2021-04-09 19:15:00,publico_es,17676713,"Madrid, Spain",1380600148355641352,27,13,[],"⭕ DIRECTO | La Comisión Europea negocia con Pfizer la compra de 1.800 millones de dosis para 2022 y 2023
https://t.co/V2CUejufdl"
2021-04-09 19:14:58,raptordanny,733384837,Madrid (Spain),1380600139677638664,0,0,[],"@Ciudaddehadria @sandy_pgrad Si, pero el miedo infundado es irracional. Si una persona por ejemplo fumadora o consu… https://t.co/PimXaJ3fHU"
2021-04-09 19:14:58,ceeliagarcia6,1092493544378564608,"Benidorm, España",1380600139539214338,0,0,[],al final vais a conseguir que cancelen la vacuna de astrazeneca puf
2021-04-09 19:14:05,_justo_gonzalez,70766106,elche,1380599919606632448,16,10,"[{'text': 'AstraZeneca', 'indices': [43, 55]}, {'text': 'EMA', 'indices': [80, 84]}]",@PorPublica Hoy me han inyectado la vacuna #AstraZeneca Toda mi confianza en la #EMA (Agencia Europea del Medicamen… https://t.co/EnpJQCbJzw
2021-04-09 19:13:46,miriammp9,436067527,Jaén-Madrid,1380599839742955527,3,0,[],Tristísimo ver como una paciente (fumadora) viene a tu consulta y te dice que está ATERRADA porque la van a vacunar… https://t.co/wxYbsPEy9j
2021-04-09 19:13:27,romarecos88,3095637203,Luque,1380599760772591618,0,0,[],"@noehx @msaludpy Vamos pues el lunes a exigirles ... yo soy instrumentadora quirurgica , trabajo en quirofano de ur… https://t.co/X4aUDVzTA8"
2021-04-09 19:13:27,LaAhVe,2946886935,Madrid,1380599760026021892,0,0,[],Nuevo centro de vacunación aquí en Madrid. El Wizink Center.
2021-04-09 19:13:05,GilRaulito,926140063,madrid ,1380599666388123657,0,0,[],@ccarballo50 Y asi es como  europa crea una guerra comercial  y se posiciona del lado americano   Quiere jhonson an… https://t.co/lXQisuna9T
2021-04-09 19:12:24,CamisetasRV,1125500430883139584,"Guadalajara, España",1380599494572642308,1,0,[],@Tetesa00554364 @ccarballo50 @nuriarevalo89 Sabes cuál es el riesgo de muerte por un trombo producido por la vacuna… https://t.co/4DGRoJnVJK
2021-04-09 19:12:20,carmen_paint,956847962252079104,"Murcia, España",1380599479028580359,2,1,[],@alcero13 Esa plaga no tiene vacuna LA SOLUCION ESTA EN NUESTRAS MANOS VOTEMOS U. PODEMOS EN MASA  Y CON EL LO LOGRAREMOS!!💜💜💜💜💜💜💜💜💜💜💜💜💜💜
2021-04-09 19:11:33,Sirku74,1087355202,España/Spain,1380599280839356423,2,0,[],@CioLerma @aunmasyo Yo creo que esta vacuna las rejuvenece. Saldrá todavía más linda....
2021-04-09 19:11:26,admtvoscoles,1702601474,Santander,1380599251277914112,0,0,[],"Revilla recibirá la vacuna el día 13: «Me da igual Pfizer, AstraZeneca, Moderna, Sputnik...»  https://t.co/uh0IG3CEJv"
2021-04-09 19:11:25,stromboli72,365757441,VLC,1380599246261522439,3,0,[],@josueguren Medios que alaban el ritmo de vacunación en R.U. (casi todo AZ sin distinguir edades y administrando só… https://t.co/86IY1GszsB
2021-04-09 19:11:12,antoniorguezIBM,232198471,"Madrid, Spain",1380599192180166661,0,0,[],"@ComunidadMadrid, me ofrezco voluntario para la vacunación Astra Zeneca"
2021-04-09 19:11:04,ricrodel,289878117,"Madrid, España",1380599158378274831,0,0,"[{'text': 'GobiernoDeInutiles', 'indices': [109, 128]}]",Miles de ciudadanos se han inhibido de la vacuna por la desastrosa información y gestión informativa de este #GobiernoDeInutiles
2021-04-09 19:11:01,Torresacab,2225433505,"Castilla-La Mancha, España",1380599146365718528,1,0,[],"@joaqmorera Pues ese es el problema. Que toda molestia, sensación o interpretación, muchos lo asocian a la vacuna.… https://t.co/rm4EOEM3XX"
2021-04-09 19:10:22,bomba_paula,1022684025888989185,"Madrid, Spain",1380598983526088712,0,0,[],Vacuna de AstraZeneca: por qué Reino Unido dejará de ofrecerla a los menores de 30 años https://t.co/0nzWxrnGgL… https://t.co/jwSh58p1go
2021-04-09 19:10:21,Almork,300641436,Castellon de la plana,1380598980552368131,0,0,[],"Con tanto vaivén chapucero, en relación con la vacuna de AstraZeneca, la gente comienza a tener miedo. El 60-70% se… https://t.co/P6E6glklAW"
2021-04-09 19:10:03,burgosconecta,2302873614,Burgos,1380598901858779138,3,2,[],Sanidad amplía la vacunación con AstraZeneca para las áreas rurales de Burgos https://t.co/FY6FrIyMGl https://t.co/EBkLScCef1
2021-04-09 19:10:02,J_ParraG,460555235,Murcia ,1380598900470452224,0,0,"[{'text': 'AstraZeneca', 'indices': [68, 80]}]","Medicamentos que aumentan el riesgo de trombos más que la vacuna de #AstraZeneca.
https://t.co/Sk9CTQiUBb"
2021-04-09 19:09:49,hasta_el_lunes,317724102,"Sevilla, España",1380598844065464323,1,2,"[{'text': 'CambioClimático', 'indices': [34, 50]}]","A las 23h comienza en este enlace #CambioClimático. Hoy os traemos, además del Proyecto de Ley, la vacuna contra la… https://t.co/kjOjTCvokC"
2021-04-09 19:09:32,d3vorador_DDL,705306783045308416,"Cantabria, España",1380598771327832064,1,0,[],"Nada como terminar la 3ª temporada de izombie, en la que usan una vacuna para expandir el virus... COVID! 😀"
2021-04-09 19:09:28,andonimendoz,706595102479745025,Castilla y  Leon. Spain.,1380598754487721990,58,6,[],"Vacuna Astra Zeneca: entre todos la mataron y ella sola se murió, gracias señores periodistas amarillos, gobernantes y políticos."
